word,reading,romaji,jlpt_level,pos,meaning_vi,meaning_en,tags,frequency,source,source_id,license,attribution,example_jp,example_reading,example_vi,example_en,review_status,meaning_source
"枯らす","からす","","N4","v5s|vt","làm khô | giết chết (thực vật) | hong khô (gỗ)","to let dry | to kill (vegetation) | to season (lumber)","","0","jmdict","1267210","CC BY-SA 3.0 — verify at edrdg.org before production use","JMdict/EDRDG","草花を枯らします。","くさばなをからします。","Tôi làm khô hoa cỏ.","I let the flowers dry.","ai_draft","jmdict_ai"
"散る","ちる","","N4","v5r|vi","rụng (hoa, lá) | tan tán | phân tán | biến mất | ngã xuống vì danh dự","to fall (e.g. blossoms, leaves) | to scatter | to be dispersed | to disappear | to dissolve | to break up | to spread | to run | to blur | to die a noble death","","0","jmdict","1303490","CC BY-SA 3.0 — verify at edrdg.org before production use","JMdict/EDRDG","花びらが散ります。","はなびらがちります。","Cánh hoa rụng.","The petals fall.","ai_draft","jmdict_ai"
"指定席","していせき","","N4","n","ghế đặt trước | ghế chỉ định","reserved seat","","0","jmdict","1309930","CC BY-SA 3.0 — verify at edrdg.org before production use","JMdict/EDRDG","指定席を予約します。","していせきをよやくします。","Tôi đặt ghế chỉ định.","I reserve a reserved seat.","ai_draft","jmdict_ai"
"実る","みのる","","N4","v5r|vi","ra quả | chín | cho kết quả | đơm hoa kết trái","to bear fruit | to ripen | to produce (good) results | to show results | to bear fruit","","0","jmdict","1320850","CC BY-SA 3.0 — verify at edrdg.org before production use","JMdict/EDRDG","努力が実ります。","どりょくがみのります。","Nỗ lực đơm hoa kết trái.","Effort bears fruit.","ai_draft","jmdict_ai"
"手本","てほん","","N4","n","mẫu | ví dụ tốt | khuôn mẫu | mẫu viết tay","model | (good) example | exemplar | paragon | model handwriting | model drawing | copybook","","0","jmdict","1328390","CC BY-SA 3.0 — verify at edrdg.org before production use","JMdict/EDRDG","手本を見て書きます。","てほんをみてかきます。","Tôi viết theo mẫu.","I write while looking at the model.","ai_draft","jmdict_ai"
"申し訳","もうしわけ","","N4","n|vs","lời xin lỗi | lý do | biện hộ","apology | excuse","","0","jmdict","1363050","CC BY-SA 3.0 — verify at edrdg.org before production use","JMdict/EDRDG","申し訳ありません。","もうしわけありません。","Tôi xin lỗi.","I am terribly sorry.","ai_draft","jmdict_ai"
"段階","だんかい","","N4","n","giai đoạn | bước | pha | cấp độ | thứ tự","stage | step | phase | level | rank | grade | gradation | order | stairs","","0","jmdict","1419950","CC BY-SA 3.0 — verify at edrdg.org before production use","JMdict/EDRDG","次の段階に進みます。","つぎのだんかいにすすみます。","Tôi tiến lên giai đoạn tiếp theo.","I advance to the next stage.","ai_draft","jmdict_ai"
"地下室","ちかしつ","","N4","n","tầng hầm | phòng hầm","cellar | basement","","0","jmdict","1420890","CC BY-SA 3.0 — verify at edrdg.org before production use","JMdict/EDRDG","地下室に荷物を置きます。","ちかしつににもつをおきます。","Tôi để hành lý ở tầng hầm.","I put the luggage in the basement.","ai_draft","jmdict_ai"
"逃げ出す","にげだす","","N4","v5s|vi","chạy trốn | bỏ chạy | tháo lui | bắt đầu chạy trốn","to run away | to flee | to make off | to take to one's heels | to escape | to start to run away","","0","jmdict","1450390","CC BY-SA 3.0 — verify at edrdg.org before production use","JMdict/EDRDG","危険から逃げ出します。","きけんからにげだします。","Tôi chạy trốn khỏi nguy hiểm.","I flee from the danger.","ai_draft","jmdict_ai"
"品揃え","しなぞろえ","","N4","n","danh mục sản phẩm | hàng hóa đa dạng | chủng loại","assortment | product lineup","","0","jmdict","1490650","CC BY-SA 3.0 — verify at edrdg.org before production use","JMdict/EDRDG","品揃えが豊富です。","しなぞろえがほうふです。","Hàng hóa đa dạng.","The assortment is rich.","ai_draft","jmdict_ai"
"洋室","ようしつ","","N4","n","phòng kiểu phương Tây","Western-style room","","0","jmdict","1545970","CC BY-SA 3.0 — verify at edrdg.org before production use","JMdict/EDRDG","洋室に住んでいます。","ようしつにすんでいます。","Tôi sống trong phòng kiểu phương Tây.","I live in a Western-style room.","ai_draft","jmdict_ai"
"立方","たちかた","","N4","n","tư thế đứng | vũ công (múa Nhật Bản)","way of standing | dancer (in a Japanese dance performance)","","0","jmdict","1551810","CC BY-SA 3.0 — verify at edrdg.org before production use","JMdict/EDRDG","正しい立方を練習します。","ただしいたちかたをれんしゅうします。","Tôi luyện tập tư thế đứng đúng.","I practice the correct stance.","ai_draft","jmdict_ai"
"和室","わしつ","","N4","n","phòng kiểu Nhật Bản","Japanese-style room","","0","jmdict","1562110","CC BY-SA 3.0 — verify at edrdg.org before production use","JMdict/EDRDG","和室でくつろぎます。","わしつでくつろぎます。","Tôi thư giãn trong phòng kiểu Nhật.","I relax in the Japanese-style room.","ai_draft","jmdict_ai"
"言い訳","いいわけ","","N4","n|vs|vt|vi","lý do | biện hộ | biện minh | bào chữa","excuse | explanation","","0","jmdict","1587030","CC BY-SA 3.0 — verify at edrdg.org before production use","JMdict/EDRDG","言い訳をしないでください。","いいわけをしないでください。","Đừng biện hộ.","Please don't make excuses.","ai_draft","jmdict_ai"
"売れ行き","うれゆき","","N4","n","tình hình bán hàng | nhu cầu thị trường","sales | demand","","0","jmdict","1588590","CC BY-SA 3.0 — verify at edrdg.org before production use","JMdict/EDRDG","売れ行きが好調です。","うれゆきがこうちょうです。","Tình hình bán hàng tốt.","Sales are going well.","ai_draft","jmdict_ai"
"泣き出す","なきだす","","N4","v5s|vi","bật khóc | oà khóc | bắt đầu khóc","to burst into tears | to burst out crying | to begin to cry | to be moved to tears","","0","jmdict","1633080","CC BY-SA 3.0 — verify at edrdg.org before production use","JMdict/EDRDG","突然泣き出します。","とつぜんなきだします。","Bỗng nhiên bật khóc.","I suddenly burst into tears.","ai_draft","jmdict_ai"
"話し相手","はなしあいて","","N4","n","người để nói chuyện | bạn trò chuyện | người cố vấn","person with whom to speak | someone to talk to | companion | advisor | adviser","","0","jmdict","1782940","CC BY-SA 3.0 — verify at edrdg.org before production use","JMdict/EDRDG","話し相手がいません。","はなしあいてがいません。","Không có ai để nói chuyện.","I have no one to talk to.","ai_draft","jmdict_ai"
"芽","め","","N4","n","mầm | chồi | nụ | phôi","sprout | shoot | bud | germinal disk (in an egg)","","0","jmdict","1197710","CC BY-SA 3.0 — verify at edrdg.org before production use","JMdict/EDRDG","芽が出ます。","めがでます。","Mầm nảy ra.","The sprout comes out.","ai_draft","jmdict_ai"
"屋根裏","やねうら","","N4","n","gác mái | tầng trên cùng | gác xép","attic | loft","","0","jmdict","1815850","CC BY-SA 3.0 — verify at edrdg.org before production use","JMdict/EDRDG","屋根裏に荷物を入れます。","やねうらににもつをいれます。","Tôi để hành lý ở gác mái.","I put luggage in the attic.","ai_draft","jmdict_ai"
"笑い出す","わらいだす","","N4","v5s","bật cười | oà cười | phá lên cười","to burst into laughter","","0","jmdict","1847730","CC BY-SA 3.0 — verify at edrdg.org before production use","JMdict/EDRDG","思わず笑い出します。","おもわずわらいだします。","Tôi bất ngờ phá lên cười.","I burst into laughter without thinking.","ai_draft","jmdict_ai"
"根","ね","","N4","n","rễ (cây) | chân (răng, tóc) | nguồn gốc | căn nguyên | bản chất thật","root (of a plant) | root (of a tooth, hair, etc.) | center (of a pimple, etc.) | root (of all evil, etc.) | source | origin | cause | basis | one's true nature | (fishing) reef","","0","jmdict","1290020","CC BY-SA 3.0 — verify at edrdg.org before production use","JMdict/EDRDG","木の根が深いです。","きのねがふかいです。","Rễ cây ăn sâu.","The tree roots are deep.","ai_draft","jmdict_ai"
"思いやり","おもいやり","","N4","n","sự đồng cảm | lòng trắc ẩn | sự quan tâm | tâm lý thấu hiểu","consideration | thoughtfulness | sympathy | compassion | feeling | kindness | understanding | regard | kindheartedness","","0","jmdict","1309180","CC BY-SA 3.0 — verify at edrdg.org before production use","JMdict/EDRDG","思いやりのある人です。","おもいやりのあるひとです。","Đó là người có lòng trắc ẩn.","They are a compassionate person.","ai_draft","jmdict_ai"
"枝","えだ","","N4","n","cành | nhánh cây | cành nhỏ","branch | bough | limb | twig | sprig | spray","","0","jmdict","1310530","CC BY-SA 3.0 — verify at edrdg.org before production use","JMdict/EDRDG","枝を切ります。","えだをきります。","Tôi cắt cành.","I cut the branch.","ai_draft","jmdict_ai"
"手配","てはい","","N4","n|vs|vt","sắp xếp | chuẩn bị | lùng bắt (của cảnh sát)","arrangement | preparations | search (by police)","","0","jmdict","1328260","CC BY-SA 3.0 — verify at edrdg.org before production use","JMdict/EDRDG","旅の手配をします。","たびのてはいをします。","Tôi sắp xếp chuyến đi.","I make travel arrangements.","ai_draft","jmdict_ai"
"組み立てる","くみたてる","","N4","v1|vt","lắp ráp | ghép lại | xây dựng | tổ hợp | soạn thảo","to assemble | to put together | to set up | to construct | to build | to compose (a story, poem, etc.) | to form (words, sentences, etc.)","","0","jmdict","1397580","CC BY-SA 3.0 — verify at edrdg.org before production use","JMdict/EDRDG","机を組み立てます。","つくえをくみたてます。","Tôi lắp ráp cái bàn.","I assemble the desk.","ai_draft","jmdict_ai"
"倉庫","そうこ","","N4","n","nhà kho | kho hàng | kho chứa","storehouse | warehouse | godown","","0","jmdict","1399120","CC BY-SA 3.0 — verify at edrdg.org before production use","JMdict/EDRDG","倉庫に荷物を入れます。","そうこににもつをいれます。","Tôi đưa hàng vào kho.","I put goods in the warehouse.","ai_draft","jmdict_ai"
"品質","ひんしつ","","N4","n","chất lượng | chất lượng sản phẩm","quality (of a product or a service)","","0","jmdict","1490580","CC BY-SA 3.0 — verify at edrdg.org before production use","JMdict/EDRDG","品質を管理します。","ひんしつをかんりします。","Tôi quản lý chất lượng.","I manage the quality.","ai_draft","jmdict_ai"
"平方","へいほう","","N4","n","bình phương | vuông (đơn vị đo)","square (e.g. metre)","","0","jmdict","1507850","CC BY-SA 3.0 — verify at edrdg.org before production use","JMdict/EDRDG","平方メートルを計算します。","へいほうメートルをけいさんします。","Tôi tính mét vuông.","I calculate square metres.","ai_draft","jmdict_ai"
"立方","りっぽう","","N4","n|vs","lập phương | hình khối lập phương","cube","","0","jmdict","1551820","CC BY-SA 3.0 — verify at edrdg.org before production use","JMdict/EDRDG","立方センチを求めます。","りっぽうセンチをもとめます。","Tôi tính xen-ti-mét khối.","I find the cubic centimetre.","ai_draft","jmdict_ai"
"前払い","まえばらい","","N4","n|vs|vt","thanh toán trước | trả trước | ứng tiền trước","payment in advance | advance payment | prepayment","","0","jmdict","1603800","CC BY-SA 3.0 — verify at edrdg.org before production use","JMdict/EDRDG","前払いでお願いします。","まえばらいでおねがいします。","Xin vui lòng thanh toán trước.","Please pay in advance.","ai_draft","jmdict_ai"
"根付く","ねづく","","N4","v5k|vi","bén rễ | ăn rễ | bám rễ","to take root | to strike","","0","jmdict","1900530","CC BY-SA 3.0 — verify at edrdg.org before production use","JMdict/EDRDG","木が根付きました。","きがねづきました。","Cây đã bén rễ.","The tree has taken root.","ai_draft","jmdict_ai"
"代引き","だいびき","","N4","n","thanh toán khi nhận hàng | COD","cash on delivery | COD","","0","jmdict","2232390","CC BY-SA 3.0 — verify at edrdg.org before production use","JMdict/EDRDG","代引きで注文します。","だいびきでちゅうもんします。","Tôi đặt hàng thanh toán khi nhận.","I order with cash on delivery.","ai_draft","jmdict_ai"
"データ収集","データしゅうしゅう","","N4","n","thu thập dữ liệu | thu thập thông tin","data collection | data acquisition","","0","jmdict","2310380","CC BY-SA 3.0 — verify at edrdg.org before production use","JMdict/EDRDG","データ収集を行います。","データしゅうしゅうをおこないます。","Tôi thực hiện thu thập dữ liệu.","I carry out data collection.","ai_draft","jmdict_ai"
"ご案内","ごあんない","","N4","n|vs","hướng dẫn | dẫn đường | thông báo | lời mời","guidance | leading (the way) | showing around | information | notice | notification | announcement (of one's arrival) | invitation | acquaintance | knowledge","","0","jmdict","2833392","CC BY-SA 3.0 — verify at edrdg.org before production use","JMdict/EDRDG","ご案内します。","ごあんないします。","Tôi xin hướng dẫn.","I will guide you.","ai_draft","jmdict_ai"
"その結果","そのけっか","","N4","exp","kết quả là | do đó | vì vậy","as a result","","0","jmdict","2851217","CC BY-SA 3.0 — verify at edrdg.org before production use","JMdict/EDRDG","その結果、成功しました。","そのけっか、せいこうしました。","Kết quả là tôi đã thành công.","As a result, I succeeded.","ai_draft","jmdict_ai"
"ご連絡","ごれんらく","","N4","n|vs|vt","liên hệ | thông báo | liên lạc","contacting | getting in touch | communication | call | message","","0","jmdict","1270820","CC BY-SA 3.0 — verify at edrdg.org before production use","JMdict/EDRDG","ご連絡ありがとうございます。","ごれんらくありがとうございます。","Cảm ơn bạn đã liên hệ.","Thank you for contacting us.","ai_draft","jmdict_ai"
"後払い","あとばらい","","N4","n|vs|vt","thanh toán sau | trả sau | trả chậm","deferred payment","","0","jmdict","1270070","CC BY-SA 3.0 — verify at edrdg.org before production use","JMdict/EDRDG","後払いが可能です。","あとばらいがかのうです。","Thanh toán sau là khả dụng.","Deferred payment is available.","ai_draft","jmdict_ai"
"ご協力","ごきょうりょく","","N4","n|vs|vi","hợp tác | cộng tác | sự giúp đỡ | ủng hộ","cooperation | collaboration | help | support","","0","jmdict","1270290","CC BY-SA 3.0 — verify at edrdg.org before production use","JMdict/EDRDG","ご協力をお願いします。","ごきょうりょくをおねがいします。","Xin vui lòng hợp tác.","Please cooperate with us.","ai_draft","jmdict_ai"
"ウォーミングアップ","ウォーミングアップ","","N4","n|vs|vi","khởi động | làm ấm cơ thể | warm-up","warming up | warm-up","","0","jmdict","1026550","CC BY-SA 3.0 — verify at edrdg.org before production use","JMdict/EDRDG","運動前にウォーミングアップします。","うんどうまえにウォーミングアップします。","Tôi khởi động trước khi tập.","I warm up before exercise.","ai_draft","jmdict_ai"
"引用","いんよう","","N4","n|vs|vt|adj-no","trích dẫn | trích đoạn | tham chiếu","quotation | citation | reference","","0","jmdict","1169660","CC BY-SA 3.0 — verify at edrdg.org before production use","JMdict/EDRDG","論文を引用します。","ろんぶんをいんようします。","Tôi trích dẫn bài luận.","I cite the paper.","ai_draft","jmdict_ai"
"応接間","おうせつま","","N4","n","phòng tiếp khách | phòng khách","reception room | parlor | parlour","","0","jmdict","1179950","CC BY-SA 3.0 — verify at edrdg.org before production use","JMdict/EDRDG","応接間でお待ちください。","おうせつまでおまちください。","Xin vui lòng chờ ở phòng tiếp khách.","Please wait in the reception room.","ai_draft","jmdict_ai"
"交互","こうご","","N4","adj-no|n|vs","xen kẽ | luân phiên | lần lượt thay thế","alternate | alternating","","0","jmdict","1271940","CC BY-SA 3.0 — verify at edrdg.org before production use","JMdict/EDRDG","交互に作業します。","こうごにさぎょうします。","Chúng tôi làm việc luân phiên.","We work alternately.","ai_draft","jmdict_ai"
"七五三","しちごさん","","N4","n","Shichi-go-san | lễ mừng trẻ em 7, 5 và 3 tuổi (15/11)","shichi-go-san | 7-5-3 day | festival day for children aged 7, 5 and 3 held on or around November 15 | lucky numbers 7, 5 and 3","","0","jmdict","1319310","CC BY-SA 3.0 — verify at edrdg.org before production use","JMdict/EDRDG","七五三のお祝いをします。","しちごさんのおいわいをします。","Tôi mừng lễ Shichi-go-san.","I celebrate shichi-go-san.","ai_draft","jmdict_ai"
"順序","じゅんじょ","","N4","n","thứ tự | trình tự | thủ tục","order | sequence | procedure","","0","jmdict","1342340","CC BY-SA 3.0 — verify at edrdg.org before production use","JMdict/EDRDG","順序を守ります。","じゅんじょをまもります。","Tôi giữ thứ tự.","I follow the order.","ai_draft","jmdict_ai"
"順番","じゅんばん","","N4","n","thứ tự | lượt | lần lượt","order | turn","","0","jmdict","1342390","CC BY-SA 3.0 — verify at edrdg.org before production use","JMdict/EDRDG","順番を待ちます。","じゅんばんをまちます。","Tôi chờ đến lượt.","I wait for my turn.","ai_draft","jmdict_ai"
"初詣","はつもうで","","N4","n","chuyến thăm đền đầu năm mới | viếng thăm đền thờ ngày tết","first shrine visit of the New Year","","0","jmdict","1342720","CC BY-SA 3.0 — verify at edrdg.org before production use","JMdict/EDRDG","初詣に行きます。","はつもうでにいきます。","Tôi đi viếng đền đầu năm.","I go to the first shrine visit of the New Year.","ai_draft","jmdict_ai"
"深呼吸","しんこきゅう","","N4","n|vs|vi","hít thở sâu","deep breath","","0","jmdict","1362720","CC BY-SA 3.0 — verify at edrdg.org before production use","JMdict/EDRDG","深呼吸してください。","しんこきゅうしてください。","Hãy hít thở sâu.","Please take a deep breath.","ai_draft","jmdict_ai"
"節分","せつぶん","","N4","n","Setsubun | ngày cuối mùa đông (khoảng 3-4/2) | lễ ném đậu","setsubun | last day of winter in the traditional Japanese calendar (usu. February 3 or 4) on which a bean scattering ceremony is held | last day of any season (according to the traditional Japanese calendar)","","0","jmdict","1386340","CC BY-SA 3.0 — verify at edrdg.org before production use","JMdict/EDRDG","節分に豆まきをします。","せつぶんにまめまきをします。","Tôi ném đậu dịp Setsubun.","I do the bean scattering at Setsubun.","ai_draft","jmdict_ai"
"段取り","だんどり","","N4","n|vs","kế hoạch | chuẩn bị | sắp xếp chương trình","programme | program | plans | arrangements","","0","jmdict","1419970","CC BY-SA 3.0 — verify at edrdg.org before production use","JMdict/EDRDG","段取りを決めます。","だんどりをきめます。","Tôi quyết định kế hoạch.","I decide on the arrangements.","ai_draft","jmdict_ai"
"余地","よち","","N4","n","chỗ trống | dư địa | phạm vi | không gian","place | room | margin | scope","","0","jmdict","1544380","CC BY-SA 3.0 — verify at edrdg.org before production use","JMdict/EDRDG","改善の余地があります。","かいぜんのよちがあります。","Có dư địa cải thiện.","There is room for improvement.","ai_draft","jmdict_ai"
