word,reading,romaji,jlpt_level,pos,meaning_vi,meaning_en,tags,frequency,source,source_id,license,attribution,example_jp,example_reading,example_vi,example_en,review_status,meaning_source
"心","こころ","","N5","n","tâm hồn | trái tim | tinh thần | ý nghĩa của câu (câu đố, v.v.)","mind | heart | spirit | the meaning of a phrase (riddle, etc.)","","0","jmdict","1360480","CC BY-SA 3.0 — verify at edrdg.org before production use","JMdict/EDRDG","心が痛いです。","こころがいたいです。","Tôi đau lòng.","My heart aches.","ai_draft","jmdict_ai"
"申し込む","もうしこむ","","N5","v5m|vt","đăng ký | nộp đơn | cầu hôn | đề nghị (hòa giải) | đưa ra đề nghị (hòa bình) | thách đấu | khiếu nại | yêu cầu (phỏng vấn) | đặt mua | đặt chỗ | đặt trước","to apply for | to make an application | to propose (marriage) | to offer (mediation) | to make an overture (of peace) | to challenge | to lodge (objections) | to request (an interview) | to subscribe for | to book | to reserve","","0","jmdict","1362890","CC BY-SA 3.0 — verify at edrdg.org before production use","JMdict/EDRDG","コースに申し込みます。","コースにもうしこみます。","Tôi đăng ký khóa học.","I apply for the course.","ai_draft","jmdict_ai"
"神社","じんじゃ","","N5","n","đền thờ Thần đạo | đền Shinto","Shinto shrine","","0","jmdict","1364670","CC BY-SA 3.0 — verify at edrdg.org before production use","JMdict/EDRDG","神社にお参りします。","じんじゃにおまいりします。","Tôi đến cầu nguyện ở đền.","I visit the shrine to pray.","ai_draft","jmdict_ai"
"世界","せかい","","N5","n|adj-no","thế giới | xã hội | vũ trụ | lĩnh vực | giới | nổi tiếng thế giới | cõi do một vị Phật cai quản | không gian","the world | society | the universe | sphere | circle | world | world-renowned | world-famous | realm governed by one Buddha | space","","0","jmdict","1373860","CC BY-SA 3.0 — verify at edrdg.org before production use","JMdict/EDRDG","世界中を旅行したいです。","せかいじゅうをりょこうしたいです。","Tôi muốn du lịch khắp thế giới.","I want to travel around the world.","ai_draft","jmdict_ai"
"世話","せわ","","N5","n|vs|vt","chăm sóc | trông nom | giúp đỡ | hỗ trợ | phiền toái | phiền phức | dịch vụ tốt | giới thiệu | cuộc sống hàng ngày | câu chuyện đời thường | ngôn ngữ đời thường | câu chuyện sewamono (kịch Edo)","care | looking after | help | assistance | aid | trouble | bother | good offices | recommendation | introduction | everyday life | everyday affairs | everyday language | sewamono (Edo-period drama about contemporary life)","","0","jmdict","1374300","CC BY-SA 3.0 — verify at edrdg.org before production use","JMdict/EDRDG","お世話になりました。","おせわになりました。","Cảm ơn vì đã chăm sóc tôi.","Thank you for taking care of me.","ai_draft","jmdict_ai"
"赤ちゃん","あかちゃん","","N5","n","em bé | trẻ sơ sinh","baby | infant","","0","jmdict","1383260","CC BY-SA 3.0 — verify at edrdg.org before production use","JMdict/EDRDG","かわいい赤ちゃんですね。","かわいいあかちゃんですね。","Em bé thật dễ thương.","What a cute baby.","ai_draft","jmdict_ai"
"成る","なる","","N5","v5r|vi|aux-v","trở thành | trở nên | lớn lên | biến thành | đạt được | đạt tới | dẫn đến | hóa ra | kết quả là | được chứng minh (là) | bao gồm | được tạo thành | được làm từ | hoàn thành | được thực hiện | thành công | được thực hiện | thay đổi (thành) | biến thành | chuyển hóa | bắt đầu (làm) | bắt đầu làm | lớn lên thành | đến | lên đến | lên tổng | tạo thành | đóng vai | đóng vai trò | được dùng cho | hữu ích cho | phục vụ như | được thăng chức | thực hiện ...","to become | to get | to grow | to turn | to reach | to attain | to result in | to turn out | to end up | to prove (to be) | to consist of | to be composed of | to be made up of | to be completed | to be realized | to succeed | to be attained | to be accomplished | to change (into) | to turn (into) | to transform | to come (to do) | to begin (to do) | to grow (to do) | to come to | to amount to | to add up to | to make | to play (the part of) | to act as | to be used for | to be useful for | to serve as | to be promoted | to do ...","","0","jmdict","1375610","CC BY-SA 3.0 — verify at edrdg.org before production use","JMdict/EDRDG","医者になりたいです。","いしゃになりたいです。","Tôi muốn trở thành bác sĩ.","I want to become a doctor.","ai_draft","jmdict_ai"
"星","ほし","","N5","n","ngôi sao (thường trừ Mặt Trời) | hành tinh (thường trừ Trái Đất) | thiên thể | ngôi sao (biểu tượng, hình dạng) | dấu hoa thị | ngôi sao (diễn viên, cầu thủ) | chấm | vết | hồng tâm | hung thủ | kẻ phạm tội | nghi phạm | số phận | vận mệnh | điểm | sao (trong cờ vây) | ngôi sao (pháo hoa)","star (usu. excluding the Sun) | planet (usu. excluding Earth) | heavenly body | star (glyph, symbol, shape) | asterisk | star (actor, player, etc.) | dot | spot | fleck | bullseye | perp | perpetrator | culprit | offender | suspect | one's star (that determines one's fate) | one's fortune | point | score | star point (intersection marked with a dot) | hoshi | (pyrotechnic) star","","0","jmdict","1376310","CC BY-SA 3.0 — verify at edrdg.org before production use","JMdict/EDRDG","星がきれいです。","ほしがきれいです。","Những ngôi sao thật đẹp.","The stars are beautiful.","ai_draft","jmdict_ai"
"生まれる","うまれる","","N5","v1|vi","được sinh ra","to be born","","0","jmdict","1378690","CC BY-SA 3.0 — verify at edrdg.org before production use","JMdict/EDRDG","東京で生まれました。","とうきょうでうまれました。","Tôi sinh ra ở Tokyo.","I was born in Tokyo.","ai_draft","jmdict_ai"
"生活","せいかつ","","N5","n|vs|vi","cuộc sống | sinh hoạt | kế sinh nhai | cuộc sống (của ai đó)","life | living | livelihood | (one's) living","","0","jmdict","1378860","CC BY-SA 3.0 — verify at edrdg.org before production use","JMdict/EDRDG","日本での生活はどうですか。","にほんでのせいかつはどうですか。","Cuộc sống ở Nhật thế nào?","How is life in Japan?","ai_draft","jmdict_ai"
"生徒","せいと","","N5","n","học sinh | học sinh phổ thông | học sinh","pupil | student | schoolchild","","0","jmdict","1379380","CC BY-SA 3.0 — verify at edrdg.org before production use","JMdict/EDRDG","生徒が多いです。","せいとがおおいです。","Có nhiều học sinh.","There are many students.","ai_draft","jmdict_ai"
"静か","しずか","","N5","adj-na","yên tĩnh | im lặng | chậm rãi | thong thả | bình yên | yên bình","quiet | silent | slow | unhurried | calm | peaceful","","0","jmdict","1381820","CC BY-SA 3.0 — verify at edrdg.org before production use","JMdict/EDRDG","ここは静かですね。","ここはしずかですね。","Nơi đây yên tĩnh nhỉ.","It is quiet here.","ai_draft","jmdict_ai"
"舌","した","","N5","n","lưỡi | vật hình lưỡi | cái búa (của chuông) | chốt (của ổ khóa) | lưỡi gà (nhạc cụ)","tongue | tongue-like object | clapper (of a bell) | talon (of a lock) | reed (of a musical instrument)","","0","jmdict","1387010","CC BY-SA 3.0 — verify at edrdg.org before production use","JMdict/EDRDG","","","","","ai_draft","jmdict_ai"
"全然","ぜんぜん","","N5","adv","(không) hề | (không) chút nào | hoàn toàn | hoàn toàn | đầy đủ | tổng thể | rất | vô cùng","(not) at all | (not) in the slightest | wholly | entirely | completely | totally | extremely | very","","0","jmdict","1395620","CC BY-SA 3.0 — verify at edrdg.org before production use","JMdict/EDRDG","全然わかりません。","ぜんぜんわかりません。","Tôi không hiểu gì cả.","I don't understand at all.","ai_draft","jmdict_ai"
"全体","ぜんたい","","N5","n|adj-no|adv","toàn bộ | toàn thể | để bắt đầu | trước hết | ... quái (ví dụ ""cái quái gì vậy?"") | ... trên đời (ví dụ ""tại sao trên đời?"") | ... trên đất (ví dụ ""ai trên đất này?"")","whole | entirety | to begin with | in the first place | ... the heck (e.g. ""what the heck?"") | ... in the world (e.g. ""why in the world?"") | ... on earth (e.g. ""who on earth?"")","","0","jmdict","1395660","CC BY-SA 3.0 — verify at edrdg.org before production use","JMdict/EDRDG","全体的に良いです。","ぜんたいてきによいです。","Nhìn chung là tốt.","Overall it is good.","ai_draft","jmdict_ai"
"全部","ぜんぶ","","N5","n|adj-no|adv","tất cả | toàn bộ | toàn thể | cả thảy","all | entire | whole | altogether","","0","jmdict","1396130","CC BY-SA 3.0 — verify at edrdg.org before production use","JMdict/EDRDG","全部食べました。","ぜんぶたべました。","Tôi đã ăn hết.","I ate everything.","ai_draft","jmdict_ai"
"棚","たな","","N5","n","kệ | bệ | giá để đồ | giàn hoa leo","shelf | ledge | rack | trellis","","0","jmdict","1416700","CC BY-SA 3.0 — verify at edrdg.org before production use","JMdict/EDRDG","棚の上に置きます。","たなのうえにおきます。","Tôi đặt lên kệ.","I put it on the shelf.","ai_draft","jmdict_ai"
"虫","むし","","N5","n","côn trùng | sâu bọ | dế | bướm đêm | giun | giun đũa | thứ bên trong người ta ảnh hưởng đến suy nghĩ | (vô thức của mình) | lo lắng | bứt rứt | người chuyên tâm một thứ | người chuyên nhất | lõi van | mushi (kiểu trò chơi bài)","insect | bug | cricket | moth | worm | roundworm | thing inside one's body believed to influence one's thoughts and feelings | (one's) unconscious | nervousness | fretfulness | person devoted to one thing | single-minded person | valve core | mushi (type of game played with a stripped deck)","","0","jmdict","1426680","CC BY-SA 3.0 — verify at edrdg.org before production use","JMdict/EDRDG","","","","","ai_draft","jmdict_ai"
"喋る","しゃべる","","N5","v5r|vt|vi","nói chuyện | tán gẫu | ba hoa","to talk | to chat | to chatter","","0","jmdict","1427510","CC BY-SA 3.0 — verify at edrdg.org before production use","JMdict/EDRDG","よく喋りますね。","よくしゃべりますね。","Bạn hay nói chuyện nhỉ.","You talk a lot.","ai_draft","jmdict_ai"
"鳥","とり","","N5","n","chim | thịt chim (đặc biệt thịt gà) | gia cầm","bird | bird meat (esp. chicken meat) | fowl | poultry","","0","jmdict","1430250","CC BY-SA 3.0 — verify at edrdg.org before production use","JMdict/EDRDG","鳥が鳴いています。","とりがないています。","Chim đang hót.","A bird is singing.","ai_draft","jmdict_ai"
"通す","とおす","","N5","v5s|vt|suf","để cho qua | cho phép qua | dẫn qua | truyền (ánh sáng, âm thanh) | dẫn điện | thấm (nước qua vải) | xuyên qua | đâm qua | xỏ qua (ví dụ lỗ) | xỏ qua (ví dụ kim) | kết nối (hai nơi) | mở (đường, lộ trình) | mời vào (nhà, phòng) | dẫn vào | trình bày hợp lý | làm cho thuyết phục | kiên trì theo (nguyên tắc) | thông qua (người trung gian) | thông qua (luật) | làm cho chín đều | đắm mình trong (ví dụ nước sốt) | làm cho ai đồng ý | tiếp tục (ở trạng thái) | kiên trì (làm) | chuyển tiếp (tin nhắn) | làm nghe được (ví dụ giọng) | làm ... đến cuối | làm ... liên tục","to let pass | to allow through | to let through | to make way (for) | to transmit (e.g. light, sound, etc.) | to conduct (electricity) | to let permeate (e.g. water through a fabric) | to permit through | to let in | to stick through (e.g. a hole) | to force through (e.g. an opening) | to thread (e.g. a needle) | to put through | to connect (e.g. two places) | to open (a route, path, etc.) | to link (e.g. by a road) | to establish (a connection between) | to join | to extend up to (somewhere) | to pass (a student, applicant, etc.) | to admit (e.g. a student) | to let through | to let in | to lead (someone) into (a house, room, etc.) | to show in | to guide in | to admit (someone) | to present logically | to make (e.g. one's argument) convincing | to be consistent (in one's reasoning) | to stick to (e.g. one's principles) | to go through (e.g. a middleman) | to put as an intermediary | to mediate via (somebody) | to do via (something) | to pass (a law) | to put through (e.g. a motion) | to make way (for) | to listen through (a door, wall, etc.) | to look through (e.g. a window) | to heat thorougly (of food) | to cook properly | to warm well | to heat evenly | to dip into (e.g. a sauce) | to pass through (e.g. a broth) | to put through (e.g. boiling water) | to make (someone) approve (e.g. a plan) | to force agreement | to push through (a proposal, idea, will, etc.) | to have one's way | to continue (in a state) | to persist in (doing) | to keep doing | to remain (in a state) | to do through the lens of | to view from the angle of | to do from the perspective of | to do to the entirety of | to cover all of | to span the whole | to do from beginning to end without a break | to finish in one session | to do all at once | to do in one go | to relay (a message, an order, etc.) | to convey (an intention, meaning, etc.) | to send through | to pass on (e.g. information) | to make heard (e.g. one's voice) | to do ... to the end | to do ... continuously | to carry through ... | to complete ...","","0","jmdict","1432900","CC BY-SA 3.0 — verify at edrdg.org before production use","JMdict/EDRDG","","","","","ai_draft","jmdict_ai"
"通る","とおる","","N5","v5r|vi|suf","đi qua | đi ngang | đi dọc | di chuyển theo | qua | sử dụng (đường) | đi qua (tuyến đường) | chạy (giữa các ga, tuyến xe buýt) | hoạt động | kết nối | đi vào trong | vào phòng | được nhận | được dẫn vào | xuyên qua | đâm qua | thấm | ngấm vào | lan tỏa | truyền xa (ví dụ giọng nói) | được chuyển tiếp (lệnh đến bếp) | được đưa đi | được truyền đạt | qua (kiểm tra, một dự luật) | được chấp thuận | được chấp nhận | được gọi bằng (tên) | được biết đến như | có tiếng là | mạch lạc | hợp lý | có lý | dễ hiểu | dễ hiểu | hợp lý | được hiểu | qua được | có vẻ như | thẳng (ví dụ vân gỗ) | hiểu biết | khôn ngoan | làm ... hoàn toàn | làm ... kỹ lưỡng","to go by | to go past | to go along | to travel along | to pass through | to use (a road) | to take (a route) | to go via | to go by way of | to run (between; of a rail service, bus route, etc.) | to operate (between) | to connect | to go indoors | to go into a room | to be admitted | to be shown in | to be ushered in | to come in | to penetrate | to pierce | to skewer | to go through | to come through | to permeate | to soak into | to spread throughout | to carry (e.g. of a voice) | to reach far | to be passed on (e.g. of a customer's order to the kitchen) | to be relayed | to be conveyed | to pass (a test, a bill in the House, etc.) | to be approved | to be accepted | to go by (a name) | to be known as | to be accepted as | to have a reputation for | to be coherent | to be logical | to be reasonable | to be comprehensible | to be understandable | to make sense | to get across (e.g. of one's point) | to be understood | to pass for | to come across as | to seem like | to be straight (e.g. wood grain) | to be well-informed | to be wise | to do ... completely | to do ... thoroughly","","0","jmdict","1433030","CC BY-SA 3.0 — verify at edrdg.org before production use","JMdict/EDRDG","この道を通ります。","このみちをとおります。","Tôi đi qua con đường này.","I go through this road.","ai_draft","jmdict_ai"
"爪","つめ","","N5","n","móng tay | móng vuốt | vuốt | móng guốc | phím đàn | cái móc | khóa","nail (e.g. fingernail, toenail) | claw | talon | hoof | plectrum | pick | hook | clasp","","0","jmdict","1433880","CC BY-SA 3.0 — verify at edrdg.org before production use","JMdict/EDRDG","","","","","ai_draft","jmdict_ai"
"定食","ていしょく","","N5","n","cơm phần | set ăn | món đặc biệt trong ngày","set meal | special (of the day)","","0","jmdict","1435650","CC BY-SA 3.0 — verify at edrdg.org before production use","JMdict/EDRDG","定食を注文します。","ていしょくをちゅうもんします。","Tôi gọi cơm phần.","I order the set meal.","ai_draft","jmdict_ai"
"庭","にわ","","N5","n","vườn | sân | sân trong | lĩnh vực (hoạt động) | khu vực","garden | yard | courtyard | field (of action) | area","","0","jmdict","1436130","CC BY-SA 3.0 — verify at edrdg.org before production use","JMdict/EDRDG","庭で遊びます。","にわであそびます。","Tôi chơi trong vườn.","I play in the garden.","ai_draft","jmdict_ai"
"弟さん","おとうとさん","","N5","n","em trai","younger brother","","0","jmdict","1436200","CC BY-SA 3.0 — verify at edrdg.org before production use","JMdict/EDRDG","弟さんはいますか。","おとうとさんはいますか。","Bạn có em trai không?","Do you have a younger brother?","ai_draft","jmdict_ai"
"閉まる","しまる","","N5","v5r|vi","đóng lại | bị đóng | khép lại | chắc khỏe (của cơ thể, khuôn mặt) | khỏe khoắn | bị khóa | siết chặt | bị siết chặt | trở nên tỉnh táo | trở nên căng thẳng","to be shut | to close | to be closed | to be firm (of a body, face, etc.) | to be well-knit | to be locked | to tighten | to be tightened | to become sober | to become tense","","0","jmdict","1436560","CC BY-SA 3.0 — verify at edrdg.org before production use","JMdict/EDRDG","ドアが閉まっています。","ドアがしまっています。","Cửa đang đóng.","The door is closed.","ai_draft","jmdict_ai"
"伝える","つたえる","","N5","v1|vt","truyền đạt | báo cáo | truyền tải | giao tiếp | nói | truyền bá | dạy | để lại (di sản)","to convey | to report | to transmit | to communicate | to tell | to impart | to propagate | to teach | to bequeath","","0","jmdict","1441870","CC BY-SA 3.0 — verify at edrdg.org before production use","JMdict/EDRDG","気持ちを伝えます。","きもちをつたえます。","Tôi truyền đạt cảm xúc.","I convey my feelings.","ai_draft","jmdict_ai"
"届く","とどく","","N5","v5k|vi","đến nơi | chạm tới | đến | truyền đến (âm thanh) | được giao hàng | đến nơi | chu đáo | cẩn thận | kỹ lưỡng | được thực hiện (ước mơ) | được đáp ứng | được truyền đến (ai đó) | được đánh giá cao | tạo ấn tượng","to reach | to touch | to get to | to carry (of sound) | to be delivered | to arrive | to be attentive | to be scrupulous | to be thorough | to be realized (of a desire) | to be fulfilled | to get through (to someone) | to be appreciated | to make an impression","","0","jmdict","1457200","CC BY-SA 3.0 — verify at edrdg.org before production use","JMdict/EDRDG","手紙が届きました。","てがみがとどきました。","Thư đã đến.","The letter arrived.","ai_draft","jmdict_ai"
"届ける","とどける","","N5","v1|vt","giao hàng | chuyển tiếp | gửi | báo cáo | thông báo | nộp thông báo (cho cơ quan chức năng) | đưa thông báo | đăng ký","to deliver | to forward | to send | to report | to notify | to file notice (to the authorities) | to give notice | to register","","0","jmdict","1457210","CC BY-SA 3.0 — verify at edrdg.org before production use","JMdict/EDRDG","荷物を届けます。","にもつをとどけます。","Tôi giao hàng.","I deliver the package.","ai_draft","jmdict_ai"
"豚","ぶた","","N5","n","lợn (Sus scrofa domesticus) | thịt lợn | người béo | mập","pig (Sus scrofa domesticus) | pork | fatso | fatty","","0","jmdict","1457390","CC BY-SA 3.0 — verify at edrdg.org before production use","JMdict/EDRDG","","","","","ai_draft","jmdict_ai"
"二","に","","N5","num","hai | 2","two | 2","","0","jmdict","1461140","CC BY-SA 3.0 — verify at edrdg.org before production use","JMdict/EDRDG","","","","","ai_draft","jmdict_ai"
"二つ","ふたつ","","N5","num","hai","two","","0","jmdict","1461160","CC BY-SA 3.0 — verify at edrdg.org before production use","JMdict/EDRDG","","","","","ai_draft","jmdict_ai"
"二週間","にしゅうかん","","N5","n","hai tuần | nửa tháng","two weeks | fortnight","","0","jmdict","1461990","CC BY-SA 3.0 — verify at edrdg.org before production use","JMdict/EDRDG","","","","","ai_draft","jmdict_ai"
"日","ひ","","N5","n","ngày | những ngày | mặt trời | ánh nắng | ánh sáng mặt trời | ban ngày | ban ngày | ngày tháng | hạn chót | những ngày (đã qua) | thời gian (ví dụ thời thơ ấu) | trường hợp (đặc biệt không may) | sự kiện","day | days | sun | sunshine | sunlight | (the) day | daytime | daylight | date | deadline | (past) days | time (e.g. of one's childhood) | case (esp. unfortunate) | event","","0","jmdict","1463770","CC BY-SA 3.0 — verify at edrdg.org before production use","JMdict/EDRDG","","","","","ai_draft","jmdict_ai"
"日本人","にほんじん","","N5","n","người Nhật Bản","Japanese person","","0","jmdict","1464700","CC BY-SA 3.0 — verify at edrdg.org before production use","JMdict/EDRDG","日本人ですか。","にほんじんですか。","Bạn là người Nhật không?","Are you Japanese?","ai_draft","jmdict_ai"
"日曜日","にちようび","","N5","n|adv","Chủ Nhật","Sunday","","0","jmdict","1464900","CC BY-SA 3.0 — verify at edrdg.org before production use","JMdict/EDRDG","日曜日は休みです。","にちようびはやすみです。","Chủ Nhật là ngày nghỉ.","Sunday is a day off.","ai_draft","jmdict_ai"
"入学","にゅうがく","","N5","n|vs|vi","nhập học | vào trường | ghi danh | tuyển sinh","admission (to a school or university) | entrance | enrolment | enrollment | matriculation","","0","jmdict","1465850","CC BY-SA 3.0 — verify at edrdg.org before production use","JMdict/EDRDG","大学に入学しました。","だいがくににゅうがくしました。","Tôi đã vào đại học.","I enrolled in university.","ai_draft","jmdict_ai"
"博物館","はくぶつかん","","N5","n","bảo tàng","museum","","0","jmdict","1474720","CC BY-SA 3.0 — verify at edrdg.org before production use","JMdict/EDRDG","博物館に行きます。","はくぶつかんにいきます。","Tôi đến bảo tàng.","I go to the museum.","ai_draft","jmdict_ai"
"髪","かみ","","N5","n","tóc (trên đầu)","hair (on the head)","","0","jmdict","1477950","CC BY-SA 3.0 — verify at edrdg.org before production use","JMdict/EDRDG","髪を切りました。","かみをきりました。","Tôi đã cắt tóc.","I cut my hair.","ai_draft","jmdict_ai"
"返事","へんじ","","N5","n|vs|vi","trả lời | hồi âm | phản hồi","reply | answer | response","","0","jmdict","1512220","CC BY-SA 3.0 — verify at edrdg.org before production use","JMdict/EDRDG","返事をください。","へんじをください。","Xin hãy trả lời.","Please reply.","ai_draft","jmdict_ai"
"弁当","べんとう","","N5","n","cơm hộp | bento Nhật","bento | Japanese box lunch","","0","jmdict","1513060","CC BY-SA 3.0 — verify at edrdg.org before production use","JMdict/EDRDG","弁当を持っていきます。","べんとうをもっていきます。","Tôi mang cơm hộp theo.","I bring a bento lunch.","ai_draft","jmdict_ai"
"鳴らす","ならす","","N5","v5s|vt","rung | kêu | ngân | gõ | hỉ mũi | búng ngón tay | bẻ khớp | nổi tiếng | được ngưỡng mộ | có tiếng | phát biểu | khẳng định | phàn nàn | xì hơi (to)","to ring | to sound | to chime | to beat | to snort (nose) | to snap (fingers) | to crack (joints) | to be popular | to be esteemed | to be reputed | to state | to insist | to complain | to fart (loudly)","","0","jmdict","1532880","CC BY-SA 3.0 — verify at edrdg.org before production use","JMdict/EDRDG","ベルを鳴らします。","ベルをならします。","Tôi rung chuông.","I ring the bell.","ai_draft","jmdict_ai"
"鳴る","なる","","N5","v5r|vi","kêu | reo | vang | dội | gầm | ầm","to sound | to ring | to resound | to echo | to roar | to rumble","","0","jmdict","1532910","CC BY-SA 3.0 — verify at edrdg.org before production use","JMdict/EDRDG","電話が鳴っています。","でんわがなっています。","Điện thoại đang đổ chuông.","The phone is ringing.","ai_draft","jmdict_ai"
"夜中","よなか","","N5","n|adv","giữa đêm | lúc nửa đêm","middle of the night | dead of night","","0","jmdict","1536930","CC BY-SA 3.0 — verify at edrdg.org before production use","JMdict/EDRDG","","","","","ai_draft","jmdict_ai"
"夕食","ゆうしょく","","N5","n","bữa tối | bữa cơm tối | bữa tối","evening meal | dinner","","0","jmdict","1542730","CC BY-SA 3.0 — verify at edrdg.org before production use","JMdict/EDRDG","夕食は何ですか。","ゆうしょくはなんですか。","Bữa tối là gì?","What is for dinner?","ai_draft","jmdict_ai"
