word,reading,romaji,jlpt_level,pos,meaning_vi,meaning_en,tags,frequency,source,source_id,license,attribution,example_jp,example_reading,example_vi,example_en,review_status,meaning_source
"明るい","あかるい","","N5","adj-i","sáng | sáng sủa | được chiếu sáng tốt | sáng (màu) | vui vẻ | hoạt bát | tươi sáng | sáng (tương lai, triển vọng) | hồng tươi | khích lệ | hứa hẹn | hiểu biết (về) | quen thuộc (với) | thành thạo | công bằng (ví dụ chính trị) | trong sạch | công minh","light | bright | well-lit | well-lighted | bright (colour) | cheerful | bright | spirited | sunny (e.g. disposition) | bright (future, prospects, etc.) | rosy | encouraging | promising | knowledgeable (about) | familiar (with) | well versed (in) | well acquainted (with) | fair (e.g. politics) | clean | impartial","","0","jmdict","1532350","CC BY-SA 3.0 — verify at edrdg.org before production use","JMdict/EDRDG","部屋が明るいです。","へやがあかるいです。","Phòng sáng sủa.","The room is bright.","ai_draft","jmdict_ai"
"予約","よやく","","N5","n|vs|vt","đặt chỗ | hẹn | đặt bàn | đặt hàng trước | hợp đồng | đặt mua | cam kết | lập trình (ví dụ thiết bị) | cài đặt (ví dụ hẹn giờ)","reservation | appointment | booking | advance order | contract | subscription | pledge | programming (e.g. a device) | setting (e.g. a timer)","","0","jmdict","1543750","CC BY-SA 3.0 — verify at edrdg.org before production use","JMdict/EDRDG","予約をお願いします。","よやくをおねがいします。","Tôi muốn đặt chỗ.","I would like to make a reservation.","ai_draft","jmdict_ai"
"丈夫","じょうぶ","","N5","adj-na","khỏe mạnh | cường tráng | chắc chắn | vững chắc | bền","healthy | robust | strong | solid | durable","","0","jmdict","1580480","CC BY-SA 3.0 — verify at edrdg.org before production use","JMdict/EDRDG","丈夫な靴ですね。","じょうぶなくつですね。","Đôi giày bền nhỉ.","What durable shoes.","ai_draft","jmdict_ai"
"来る","きたる","","N5","adj-pn|v5r|vi","... tới | sắp tới | sắp đến | đến | tới | sẽ đến","next (e.g. ""next April"") | forthcoming | coming | to come | to arrive | to be due to","","0","jmdict","1591270","CC BY-SA 3.0 — verify at edrdg.org before production use","JMdict/EDRDG","","","","","ai_draft","jmdict_ai"
"回る","もとおる","","N5","v5r|vi","đi vòng quanh","to wander around","","0","jmdict","1605260","CC BY-SA 3.0 — verify at edrdg.org before production use","JMdict/EDRDG","","","","","ai_draft","jmdict_ai"
"柔らかい","やわらかい","","N5","adj-i","mềm | dịu | dẻo | linh hoạt | uyển chuyển | mềm yếu | nhẹ nhàng | dịu dàng | mềm mại | nhẹ (chủ đề, sách) | không chính thức | linh hoạt (tư duy) | dễ thích nghi","soft | tender | supple | flexible | limber | limp | gentle | mild | soft | mellow | light (topic, book, etc.) | informal | flexible (thinking, mind, etc.) | malleable | adaptable","","0","jmdict","1605630","CC BY-SA 3.0 — verify at edrdg.org before production use","JMdict/EDRDG","柔らかいパンです。","やわらかいパンです。","Bánh mì mềm.","The bread is soft.","ai_draft","jmdict_ai"
"港","こう","","N5","suf","bến cảng","harbour","","0","jmdict","2085750","CC BY-SA 3.0 — verify at edrdg.org before production use","JMdict/EDRDG","","","","","ai_draft","jmdict_ai"
"好き","ずき","","N5","suf","yêu thích | đam mê | người hâm mộ | tín đồ | -phile | được thu hút bởi | được yêu thích","love of | affection for | enthusiast for | lover of | fan | -phile | being attractive to | being liked by","","0","jmdict","2146440","CC BY-SA 3.0 — verify at edrdg.org before production use","JMdict/EDRDG","","","","","ai_draft","jmdict_ai"
"口","く","","N5","n|suf|ctr","miệng | lời nói | đơn vị đếm người hoặc vật dụng","mouth | speech | counter for people or implements","","0","jmdict","2271620","CC BY-SA 3.0 — verify at edrdg.org before production use","JMdict/EDRDG","","","","","ai_draft","jmdict_ai"
"足","そく","","N5","ctr","đơn vị đếm cho đôi tất, giày, v.v.","counter for pairs of socks, shoes, etc.","","0","jmdict","2412230","CC BY-SA 3.0 — verify at edrdg.org before production use","JMdict/EDRDG","","","","","ai_draft","jmdict_ai"
"開ける","はだける","","N5","v1|vt|vi","mở (ví dụ áo choàng) | để lộ (ví dụ ngực) | phơi bày | mở rộng (quần áo) | bị phơi ra | mở rộng (chân, mắt, miệng) | duỗi ra","to open (e.g. one's robe) | to bare (e.g. one's chest) | to expose | to open up (of clothing) | to be exposed | to open wide (one's legs, eyes, mouth, etc.) | to stretch","","0","jmdict","2413170","CC BY-SA 3.0 — verify at edrdg.org before production use","JMdict/EDRDG","","","","","ai_draft","jmdict_ai"
"猫","ねこま","","N5","n","mèo","cat","","0","jmdict","2698030","CC BY-SA 3.0 — verify at edrdg.org before production use","JMdict/EDRDG","猫が好きです。","ねこがすきです。","Tôi thích mèo.","I like cats.","ai_draft","jmdict_ai"
"妹","いも","","N5","n","người yêu (phụ nữ) | em | mình yêu | hôn thê | chị gái | bạn gái thân","darling (woman) | dear | honey | my betrothed | one's sister | friend","","0","jmdict","2752050","CC BY-SA 3.0 — verify at edrdg.org before production use","JMdict/EDRDG","","","","","ai_draft","jmdict_ai"
"男","だん","","N5","n","danh từ giống đực | con trai | nam tước | đàn ông | nam giới","masculine noun | son | baron | man | male","","0","jmdict","2843485","CC BY-SA 3.0 — verify at edrdg.org before production use","JMdict/EDRDG","","","","","ai_draft","jmdict_ai"
"昼食","ちゅうじき","","N5","n","bữa trưa | bữa ăn trưa | thức ăn trong tiệc trà","lunch | midday meal | food served at a tea party","","0","jmdict","2863029","CC BY-SA 3.0 — verify at edrdg.org before production use","JMdict/EDRDG","昼食はどうしますか。","ちゅうしょくはどうしますか。","Bữa trưa thế nào?","What about lunch?","ai_draft","jmdict_ai"
