word,reading,romaji,jlpt_level,pos,meaning_vi,meaning_en,tags,frequency,source,source_id,license,attribution,example_jp,example_reading,example_vi,example_en,review_status,meaning_source
"感じ取る","かんじとる","","N4","v5r|vt","cảm nhận | nhận ra | nắm bắt","to perceive | to sense | to take in | to grasp | to feel","","0","jmdict","1212270","CC BY-SA 3.0 — verify at edrdg.org before production use","JMdict/EDRDG","変化を感じ取ります。","へんかをかんじとります。","Tôi cảm nhận sự thay đổi.","I perceive the change.","ai_draft","jmdict_ai"
"気にかける","きにかける","","N4","exp|v1|vt","lo lắng về | băn khoăn | quan tâm đến","to weigh on one's mind | to trouble one's heart | to be concerned about | to worry about","","0","jmdict","1221700","CC BY-SA 3.0 — verify at edrdg.org before production use","JMdict/EDRDG","友達のことを気にかけます。","ともだちのことをきにかけます。","Tôi quan tâm đến bạn bè.","I am concerned about my friend.","ai_draft","jmdict_ai"
"広まる","ひろまる","","N4","v5r|vi","lan rộng | phổ biến","to spread | to be propagated","","0","jmdict","1278450","CC BY-SA 3.0 — verify at edrdg.org before production use","JMdict/EDRDG","噂が広まります。","うわさがひろまります。","Tin đồn lan rộng.","The rumor spreads.","ai_draft","jmdict_ai"
"考え込む","かんがえこむ","","N4","v5m|vi","suy ngẫm sâu | trầm tư | lo âu","to ponder | to brood","","0","jmdict","1281030","CC BY-SA 3.0 — verify at edrdg.org before production use","JMdict/EDRDG","深く考え込みます。","ふかくかんがえこみます。","Tôi suy nghĩ sâu sắc.","I brood deeply.","ai_draft","jmdict_ai"
"手渡す","てわたす","","N4","v5s|vt","trao tận tay | giao tận tay","to hand (over) | to deliver in person","","0","jmdict","1328210","CC BY-SA 3.0 — verify at edrdg.org before production use","JMdict/EDRDG","書類を手渡します。","しょるいをてわたします。","Tôi trao tận tay tài liệu.","I hand over the documents in person.","ai_draft","jmdict_ai"
"柔軟","じゅうなん","","N4","adj-na|n","linh hoạt | mềm mại | dẻo | thể dục thể hình","flexible | lithe | soft | pliable | calisthenics","","0","jmdict","1335480","CC BY-SA 3.0 — verify at edrdg.org before production use","JMdict/EDRDG","柔軟な対応が必要です。","じゅうなんなたいおうがひつようです。","Cần phản ứng linh hoạt.","Flexible response is needed.","ai_draft","jmdict_ai"
"数千","すうせん","","N4","n","hàng nghìn | vài nghìn","thousands | several thousand","","0","jmdict","1373120","CC BY-SA 3.0 — verify at edrdg.org before production use","JMdict/EDRDG","数千人が参加します。","すうせんにんがさんかします。","Hàng nghìn người tham gia.","Thousands of people participate.","ai_draft","jmdict_ai"
"相対的","そうたいてき","","N4","adj-na","tương đối","relative","","0","jmdict","1401180","CC BY-SA 3.0 — verify at edrdg.org before production use","JMdict/EDRDG","相対的に見ると違います。","そうたいてきにみるとちがいます。","Nhìn một cách tương đối thì khác nhau.","It looks different relatively speaking.","ai_draft","jmdict_ai"
"体力","たいりょく","","N4","n","sức mạnh thể chất | thể lực | sức bền | sức chịu đựng","physical strength | power | stamina | endurance | vigor | resistance to disease | strength (of a business, economy, etc.)","","0","jmdict","1409760","CC BY-SA 3.0 — verify at edrdg.org before production use","JMdict/EDRDG","体力をつけます。","たいりょくをつけます。","Tôi tăng cường thể lực.","I build up physical strength.","ai_draft","jmdict_ai"
"搭乗","とうじょう","","N4","n|vs|vi","lên tàu | lên máy bay | lên xe","embarkation | boarding (a ship or aircraft)","","0","jmdict","1447400","CC BY-SA 3.0 — verify at edrdg.org before production use","JMdict/EDRDG","飛行機に搭乗します。","ひこうきにとうじょうします。","Tôi lên máy bay.","I board the airplane.","ai_draft","jmdict_ai"
"同様","どうよう","","N4","adj-no|adj-na|n|n-suf","giống như | tương tự | bằng nhau","same | similar | (just) like | equal","","0","jmdict","1453550","CC BY-SA 3.0 — verify at edrdg.org before production use","JMdict/EDRDG","同様の方法で行います。","どうようのほうほうでおこないます。","Tôi thực hiện bằng phương pháp tương tự.","I do it in the same way.","ai_draft","jmdict_ai"
"問いかける","といかける","","N4","v1|vt","đặt câu hỏi | hỏi | bắt đầu hỏi","to ask a question | to begin to ask a question","","0","jmdict","1535940","CC BY-SA 3.0 — verify at edrdg.org before production use","JMdict/EDRDG","自分に問いかけます。","じぶんにといかけます。","Tôi tự hỏi bản thân mình.","I ask myself a question.","ai_draft","jmdict_ai"
"に比べ","にくらべ","","N4","exp","so với | so sánh với","compared to","","0","jmdict","1009840","CC BY-SA 3.0 — verify at edrdg.org before production use","JMdict/EDRDG","去年に比べて暖かいです。","きょねんにくらべてあたたかいです。","So với năm ngoái thì ấm hơn.","It is warmer compared to last year.","ai_draft","jmdict_ai"
"直行","ちょっこう","","N4","n|vs|vi|adj-no","đi thẳng | đi thẳng tới đích | không dừng | quyết đoán","going straight (to) | going direct | going without stopping | unwavering action | decisive action | upright conduct","","0","jmdict","1430960","CC BY-SA 3.0 — verify at edrdg.org before production use","JMdict/EDRDG","直行便で行きます。","ちょっこうびんでいきます。","Tôi đi chuyến bay thẳng.","I go on a direct flight.","ai_draft","jmdict_ai"
"通じる","つうじる","","N4","v1|vi","thông | dẫn đến | liên lạc được | hiểu được | tinh thông | phổ biến rộng rãi","to be open (to traffic) | to lead to | to communicate (with) | to flow (liquid, current) | to pass | to get through to | to be understood | to be comprehended | to be honored | to be good | to be well versed in | to be well-informed | to communicate clandestinely | to keep in touch (e.g. with the enemy) | to form a liaison | to be intimate | to spread widely | to disseminate","","0","jmdict","1432880","CC BY-SA 3.0 — verify at edrdg.org before production use","JMdict/EDRDG","英語が通じます。","えいごがつうじます。","Tiếng Anh được hiểu.","English gets through.","ai_draft","jmdict_ai"
"廃棄物","はいきぶつ","","N4","n","chất thải | rác thải | phế liệu","waste matter | waste | garbage | trash","","0","jmdict","1472040","CC BY-SA 3.0 — verify at edrdg.org before production use","JMdict/EDRDG","廃棄物を処理します。","はいきぶつをしょりします。","Tôi xử lý chất thải.","I dispose of waste.","ai_draft","jmdict_ai"
"排気","はいき","","N4","n|vs|vi","khí thải | ống xả | thông gió","exhaust | emission (of gas from an engine) | expulsion (of air) | ventilation","","0","jmdict","1472320","CC BY-SA 3.0 — verify at edrdg.org before production use","JMdict/EDRDG","排気ガスを減らします。","はいきガスをへらします。","Tôi giảm khí thải.","I reduce exhaust fumes.","ai_draft","jmdict_ai"
"品切れ","しなぎれ","","N4","n|adj-no","hết hàng | bán hết","out of stock | sold out","","0","jmdict","1490640","CC BY-SA 3.0 — verify at edrdg.org before production use","JMdict/EDRDG","品切れになりました。","しなぎれになりました。","Hàng đã bán hết.","We are sold out.","ai_draft","jmdict_ai"
"撫でる","なでる","","N4","v1|vt","vuốt ve | xoa đầu | chải (tóc) | xoa nhẹ","to stroke | to caress | to brush gently | to pat | to rub | to comb (hair) | to smooth down","","0","jmdict","1498290","CC BY-SA 3.0 — verify at edrdg.org before production use","JMdict/EDRDG","猫を撫でます。","ねこをなでます。","Tôi vuốt ve con mèo.","I stroke the cat.","ai_draft","jmdict_ai"
"平静","へいせい","","N4","n|adj-na","bình tĩnh | điềm tĩnh | yên tĩnh | bình thản","calm | peace | serenity | tranquility | tranquillity | composure | equanimity | presence of mind","","0","jmdict","1507530","CC BY-SA 3.0 — verify at edrdg.org before production use","JMdict/EDRDG","平静を保ちます。","へいせいをたもちます。","Tôi giữ bình tĩnh.","I maintain composure.","ai_draft","jmdict_ai"
"返品","へんぴん","","N4","n|vs|vt|vi","trả hàng | hàng trả lại","returned goods | returning purchased goods","","0","jmdict","1512300","CC BY-SA 3.0 — verify at edrdg.org before production use","JMdict/EDRDG","商品を返品します。","しょうひんをへんぴんします。","Tôi trả lại sản phẩm.","I return the product.","ai_draft","jmdict_ai"
"揚げ物","あげもの","","N4","n","đồ chiên | món chiên giòn","deep-fried food","","0","jmdict","1545530","CC BY-SA 3.0 — verify at edrdg.org before production use","JMdict/EDRDG","揚げ物が好きです。","あげものがすきです。","Tôi thích đồ chiên.","I like deep-fried food.","ai_draft","jmdict_ai"
"溜める","ためる","","N4","v1|vt","tích lũy | gom góp | để dành | để nợ","to amass | to accumulate | to store | to leave unpaid","","0","jmdict","1552630","CC BY-SA 3.0 — verify at edrdg.org before production use","JMdict/EDRDG","お金を溜めます。","おかねをためます。","Tôi để dành tiền.","I save money.","ai_draft","jmdict_ai"
"溜まる","たまる","","N4","v5r|vi","tích tụ | đọng lại | chồng chất | tích lũy","to collect | to gather | to save | to accumulate | to pile up","","0","jmdict","1552650","CC BY-SA 3.0 — verify at edrdg.org before production use","JMdict/EDRDG","ストレスが溜まります。","ストレスがたまります。","Stress tích lũy lại.","Stress accumulates.","ai_draft","jmdict_ai"
"頷く","うなずく","","N4","v5k|vi","gật đầu | đồng ý bằng cách gật đầu","to nod | to bow one's head in assent | to agree","","0","jmdict","1574310","CC BY-SA 3.0 — verify at edrdg.org before production use","JMdict/EDRDG","同意して頷きます。","どういしてうなずきます。","Tôi gật đầu đồng ý.","I nod in agreement.","ai_draft","jmdict_ai"
"切り出す","きりだす","","N4","v5s|vt","khai thác đá | cưa gỗ | bắt đầu nói chuyện | phá băng | chắt lọc (từ file media)","to quarry | to cut (timber) | to cut and carry off | to begin to talk | to break the ice | to broach | to start a fire (with flint, by rubbing sticks together, etc.) | to select and extract (from a media file) | to splice out","","0","jmdict","1580950","CC BY-SA 3.0 — verify at edrdg.org before production use","JMdict/EDRDG","本題を切り出します。","ほんだいをきりだします。","Tôi đi vào chủ đề chính.","I broach the main topic.","ai_draft","jmdict_ai"
"喜び","よろこび","","N4","n","niềm vui | hân hoan | sự vui mừng | lời chúc mừng","joy | delight | rapture | pleasure | gratification | rejoicing | congratulations | felicitations","","0","jmdict","1606140","CC BY-SA 3.0 — verify at edrdg.org before production use","JMdict/EDRDG","喜びを感じます。","よろこびをかんじます。","Tôi cảm nhận niềm vui.","I feel joy.","ai_draft","jmdict_ai"
"味見","あじみ","","N4","n|vs|vt","thử vị | nếm thử","tasting | sampling","","0","jmdict","1722300","CC BY-SA 3.0 — verify at edrdg.org before production use","JMdict/EDRDG","料理を味見します。","りょうりをあじみします。","Tôi nếm thử món ăn.","I taste the dish.","ai_draft","jmdict_ai"
"寂しさ","さびしさ","","N4","n","nỗi cô đơn | sự hiu quạnh","(feeling of) loneliness | desolation","","0","jmdict","2423480","CC BY-SA 3.0 — verify at edrdg.org before production use","JMdict/EDRDG","寂しさを感じます。","さびしさをかんじます。","Tôi cảm thấy cô đơn.","I feel loneliness.","ai_draft","jmdict_ai"
"地方","じかた","","N4","n","người phụ trách âm nhạc (biểu diễn múa) | bờ biển | vùng quê | nông thôn","person in charge of music (in a Japanese dance performance) | person singing ballads (in noh) | coast (esp. as seen from the water) | shore | the country | countryside | the provinces | rural area","","0","jmdict","2796690","CC BY-SA 3.0 — verify at edrdg.org before production use","JMdict/EDRDG","地方の音楽を担当します。","じかたのおんがくをたんとうします。","Tôi phụ trách âm nhạc biểu diễn.","I am in charge of the music for the performance.","ai_draft","jmdict_ai"
"兄弟","けいてい","","N4","n","anh em trai | huynh đệ (cách đọc hán văn)","older and younger brothers | brothers","","0","jmdict","2870775","CC BY-SA 3.0 — verify at edrdg.org before production use","JMdict/EDRDG","兄弟の仲が良いです。","けいていのなかがよいです。","Tình anh em rất tốt.","The relationship between brothers is good.","ai_draft","jmdict_ai"
"絵画","かいが","","N4","n","tranh vẽ | hội họa","painting | picture","","0","jmdict","1202300","CC BY-SA 3.0 — verify at edrdg.org before production use","JMdict/EDRDG","絵画を鑑賞します。","かいがをかんしょうします。","Tôi thưởng thức tranh vẽ.","I appreciate paintings.","ai_draft","jmdict_ai"
"権利","けんり","","N4","n","quyền lợi | đặc quyền | quyền","right | privilege","","0","jmdict","1258200","CC BY-SA 3.0 — verify at edrdg.org before production use","JMdict/EDRDG","権利を守ります。","けんりをまもります。","Tôi bảo vệ quyền lợi.","I protect rights.","ai_draft","jmdict_ai"
"見合わせる","みあわせる","","N4","v1|vt","nhìn nhau | hoãn lại | so sánh | đối chiếu","to exchange glances | to look at each other | to postpone | to put off | to withhold | to abandon | to contrast | to compare","","0","jmdict","1259570","CC BY-SA 3.0 — verify at edrdg.org before production use","JMdict/EDRDG","計画を見合わせます。","けいかくをみあわせます。","Tôi hoãn kế hoạch.","I postpone the plan.","ai_draft","jmdict_ai"
"見守る","みまもる","","N4","v5r|vt","trông chừng | canh giữ | dõi theo | nhìn chăm chú","to watch over | to keep watch over | to keep an eye on | to watch intently | to stare | to gaze | to watch (and see what happens) | to follow","","0","jmdict","1259680","CC BY-SA 3.0 — verify at edrdg.org before production use","JMdict/EDRDG","子供を見守ります。","こどもをみまもります。","Tôi trông chừng trẻ em.","I watch over the children.","ai_draft","jmdict_ai"
"行き先","いきさき","","N4","n","điểm đến | nơi đến | tương lai | triển vọng","destination | whereabouts | future | prospects","","0","jmdict","1281720","CC BY-SA 3.0 — verify at edrdg.org before production use","JMdict/EDRDG","行き先を教えます。","いきさきをおしえます。","Tôi cho biết điểm đến.","I tell you the destination.","ai_draft","jmdict_ai"
"作曲","さっきょく","","N4","n|vs|vt|vi","sáng tác âm nhạc | soạn nhạc","composition (of music) | setting | writing music","","0","jmdict","1297650","CC BY-SA 3.0 — verify at edrdg.org before production use","JMdict/EDRDG","曲を作曲します。","きょくをさっきょくします。","Tôi sáng tác bài nhạc.","I compose a piece of music.","ai_draft","jmdict_ai"
"作詞","さくし","","N4","n|vs|vt|vi","viết lời bài hát | sáng tác lời nhạc","(writing) song lyrics","","0","jmdict","1297680","CC BY-SA 3.0 — verify at edrdg.org before production use","JMdict/EDRDG","歌詞を作詞します。","かしをさくしします。","Tôi viết lời bài hát.","I write song lyrics.","ai_draft","jmdict_ai"
"撮影","さつえい","","N4","n|vs|vt","chụp ảnh | quay phim | ghi hình","photography (still or motion) | photographing | filming | shooting | (video) recording","","0","jmdict","1298800","CC BY-SA 3.0 — verify at edrdg.org before production use","JMdict/EDRDG","写真を撮影します。","しゃしんをさつえいします。","Tôi chụp ảnh.","I take photos.","ai_draft","jmdict_ai"
"数百","すうひゃく","","N4","n","hàng trăm | vài trăm","several hundred | hundreds (of)","","0","jmdict","1373250","CC BY-SA 3.0 — verify at edrdg.org before production use","JMdict/EDRDG","数百人が来ます。","すうひゃくにんがきます。","Hàng trăm người đến.","Hundreds of people come.","ai_draft","jmdict_ai"
"走り回る","はしりまわる","","N4","v5r|vi","chạy lung tung | chạy khắp nơi","to run around","","0","jmdict","1402430","CC BY-SA 3.0 — verify at edrdg.org before production use","JMdict/EDRDG","子供が走り回ります。","こどもがはしりまわります。","Trẻ em chạy lung tung.","The children run around.","ai_draft","jmdict_ai"
"働きかける","はたらきかける","","N4","v1|vt|vi","tác động lên | kêu gọi | tiếp cận | gây áp lực | bắt đầu làm việc","to work on (someone) | to appeal to | to make approaches to | to pressure | to exert influence on | to seek action from | to begin to work","","0","jmdict","1451060","CC BY-SA 3.0 — verify at edrdg.org before production use","JMdict/EDRDG","政府に働きかけます。","せいふにはたらきかけます。","Tôi kêu gọi chính phủ.","I appeal to the government.","ai_draft","jmdict_ai"
"同等","どうとう","","N4","adj-na|adj-no|n","bình đẳng | ngang hàng | tương đương","equality | equal | same rights | same rank | equivalence","","0","jmdict","1453190","CC BY-SA 3.0 — verify at edrdg.org before production use","JMdict/EDRDG","同等の扱いをします。","どうとうのあつかいをします。","Tôi đối xử bình đẳng.","I treat equally.","ai_draft","jmdict_ai"
"話しかける","はなしかける","","N4","v1|vt","bắt chuyện | trò chuyện với | bắt đầu nói chuyện","to address (someone) | to accost a person | to talk (to someone) | to begin to talk | to start a conversation","","0","jmdict","1562300","CC BY-SA 3.0 — verify at edrdg.org before production use","JMdict/EDRDG","知らない人に話しかけます。","しらないひとにはなしかけます。","Tôi bắt chuyện với người lạ.","I talk to a stranger.","ai_draft","jmdict_ai"
"文書","ぶんしょ","","N4","n","tài liệu | văn bản | giấy tờ | hồ sơ | thư","document | writing | letter | papers | notes | records | archives | document addressed to someone","","0","jmdict","1583840","CC BY-SA 3.0 — verify at edrdg.org before production use","JMdict/EDRDG","文書を作成します。","ぶんしょをさくせいします。","Tôi soạn thảo tài liệu.","I prepare a document.","ai_draft","jmdict_ai"
"売り場","うりば","","N4","n","khu bán hàng | quầy hàng | gian hàng | thời điểm tốt để bán","selling area | counter | section | department | sales floor | favorable time to sell | good time to sell","","0","jmdict","1588550","CC BY-SA 3.0 — verify at edrdg.org before production use","JMdict/EDRDG","売り場を探します。","うりばをさがします。","Tôi tìm quầy hàng.","I look for the counter.","ai_draft","jmdict_ai"
"切り替える","きりかえる","","N4","v1|vt","chuyển đổi | thay thế | đổi sang | gia hạn","to change | to switch | to change over (to) | to renew","","0","jmdict","1591780","CC BY-SA 3.0 — verify at edrdg.org before production use","JMdict/EDRDG","モードを切り替えます。","モードをきりかえます。","Tôi chuyển đổi chế độ.","I switch the mode.","ai_draft","jmdict_ai"
"環境問題","かんきょうもんだい","","N4","n","vấn đề môi trường","environmental problem | environmental issue","","0","jmdict","1932330","CC BY-SA 3.0 — verify at edrdg.org before production use","JMdict/EDRDG","環境問題を考えます。","かんきょうもんだいをかんがえます。","Tôi suy nghĩ về vấn đề môi trường.","I think about environmental problems.","ai_draft","jmdict_ai"
"声をかける","こえをかける","","N4","exp|v1","chào hỏi | gọi to | bắt chuyện | mời | liên lạc | cổ vũ","to greet | to call out (to) | to start talking (to) | to invite | to get in touch (with) | to give a shout (to) | to let (someone) know (one is in the area or has time to meet, etc.) | to cheer (on) | to give vocal support (to)","","0","jmdict","1593080","CC BY-SA 3.0 — verify at edrdg.org before production use","JMdict/EDRDG","友達に声をかけます。","ともだちにこえをかけます。","Tôi gọi bạn bè.","I call out to my friend.","ai_draft","jmdict_ai"
"問い合わせ","といあわせ","","N4","n","thắc mắc | hỏi thêm thông tin | yêu cầu tư vấn","inquiry | query | enquiry","","0","jmdict","1598590","CC BY-SA 3.0 — verify at edrdg.org before production use","JMdict/EDRDG","問い合わせに答えます。","といあわせにこたえます。","Tôi trả lời thắc mắc.","I answer the inquiry.","ai_draft","jmdict_ai"
