word,reading,romaji,jlpt_level,pos,meaning_vi,meaning_en,tags,frequency,source,source_id,license,attribution,example_jp,example_reading,example_vi,example_en,review_status,meaning_source
"夕方","ゆうがた","","N5","n|adv","chiều tối (thường từ 3 đến 6 giờ chiều) | lúc hoàng hôn","early evening (usu. from 3pm to 6pm) | dusk","","0","jmdict","1542790","CC BY-SA 3.0 — verify at edrdg.org before production use","JMdict/EDRDG","夕方に帰ります。","ゆうがたにかえります。","Tôi về vào buổi chiều tối.","I return in the evening.","ai_draft","jmdict_ai"
"予定","よてい","","N5","n|vs|vt","kế hoạch | sắp xếp | lịch trình | chương trình | dự kiến | ước tính","plans | arrangement | schedule | program | programme | expectation | estimate","","0","jmdict","1543240","CC BY-SA 3.0 — verify at edrdg.org before production use","JMdict/EDRDG","予定はありますか。","よていはありますか。","Bạn có kế hoạch không?","Do you have plans?","ai_draft","jmdict_ai"
"両方","りょうほう","","N5","n|adj-no","cả hai | cả hai phía | cả hai bên","both | both sides | both parties","","0","jmdict","1554010","CC BY-SA 3.0 — verify at edrdg.org before production use","JMdict/EDRDG","両方ください。","りょうほうください。","Cho tôi cả hai.","Please give me both.","ai_draft","jmdict_ai"
"力","ちから","","N5","n","sức mạnh | sức lực | uy lực | sức sống | năng lượng | khả năng | năng lực | thành thạo | sức chứa | hiệu lực | tác dụng | nỗ lực | cố gắng | quyền lực | uy quyền | ảnh hưởng | dịch vụ tốt | sự hỗ trợ | giúp đỡ | nguồn lực","force | strength | might | vigour | vigor | energy | capability | ability | proficiency | capacity | faculty | efficacy | effect | effort | endeavours | endeavors | exertions | power | authority | influence | good offices | agency | support | help | aid | assistance | stress | emphasis | means | resources","","0","jmdict","1554820","CC BY-SA 3.0 — verify at edrdg.org before production use","JMdict/EDRDG","力を合わせましょう。","ちからをあわせましょう。","Hãy hợp sức lại.","Let's combine our strength.","ai_draft","jmdict_ai"
"連れる","つれる","","N5","v1|vt","dẫn (ai đó) cùng đi | mang theo | đi cùng | được đi cùng","to take (someone) with one | to bring along | to go with | to be accompanied by","","0","jmdict","1559290","CC BY-SA 3.0 — verify at edrdg.org before production use","JMdict/EDRDG","子供を連れていきます。","こどもをつれていきます。","Tôi dẫn con đi.","I take my child with me.","ai_draft","jmdict_ai"
"背","せ","","N5","n","lưng | mặt sau | phần sau (ví dụ ghế) | gáy (sách) | chiều cao | tầm vóc | sườn núi","back | reverse | rear side | back (e.g. of a chair) | spine (of a book) | height | stature | ridge (of a mountain)","","0","jmdict","2147990","CC BY-SA 3.0 — verify at edrdg.org before production use","JMdict/EDRDG","背が高いですね。","せがたかいですね。","Bạn cao nhỉ.","You are tall.","ai_draft","jmdict_ai"
"店","みせ","","N5","n","cửa hàng | tiệm | cơ sở | nhà hàng","store | shop | establishment | restaurant","","0","jmdict","1582120","CC BY-SA 3.0 — verify at edrdg.org before production use","JMdict/EDRDG","このお店はどこですか。","このおみせはどこですか。","Cửa hàng này ở đâu?","Where is this shop?","ai_draft","jmdict_ai"
"二人","ふたり","","N5","n","hai người | một cặp | đôi","two persons | two people | pair | couple","","0","jmdict","1582670","CC BY-SA 3.0 — verify at edrdg.org before production use","JMdict/EDRDG","二人で行きます。","ふたりでいきます。","Chúng tôi đi hai người.","We go as two people.","ai_draft","jmdict_ai"
"日本","にほん","","N5","n","Nhật Bản","Japan","","0","jmdict","1582710","CC BY-SA 3.0 — verify at edrdg.org before production use","JMdict/EDRDG","日本に住んでいます。","にほんにすんでいます。","Tôi sống ở Nhật Bản.","I live in Japan.","ai_draft","jmdict_ai"
"平均","へいきん","","N5","n|vs|vt|vi","trung bình | cân bằng | cân đối","average | mean | balance | equilibrium","","0","jmdict","1583870","CC BY-SA 3.0 — verify at edrdg.org before production use","JMdict/EDRDG","平均点は何点ですか。","へいきんてんはなんてんですか。","Điểm trung bình là bao nhiêu?","What is the average score?","ai_draft","jmdict_ai"
"暖かい","あたたかい","","N5","adj-i","ấm | nhẹ | (dễ chịu) nóng | ân cần | tử tế | thân thiện | ấm (màu sắc) | dịu dàng | có đủ tiền","warm | mild | (pleasantly) hot | considerate | kind | genial | warm (of a colour) | mellow | having enough money","","0","jmdict","1586420","CC BY-SA 3.0 — verify at edrdg.org before production use","JMdict/EDRDG","今日は暖かいですね。","きょうはあたたかいですね。","Hôm nay ấm nhỉ.","It is warm today.","ai_draft","jmdict_ai"
"言う","いう","","N5","v5u|vt|vi","nói | phát ngôn | tuyên bố | đặt tên | gọi tên | kêu (ví dụ ""chuông kêu ping"") | phát ra tiếng","to say | to utter | to declare | to name | to call | to go (e.g. ""the alarm went ping"") | to make a noise","","0","jmdict","1587040","CC BY-SA 3.0 — verify at edrdg.org before production use","JMdict/EDRDG","何と言いましたか。","なんといいましたか。","Bạn nói gì vậy?","What did you say?","ai_draft","jmdict_ai"
"頂く","いただく","","N5","v5k|vt|aux-v","nhận | lấy | chấp nhận | nhận lấy | mua | ăn | uống | được đội (trên đầu) | mặc (trên đầu) | có (ở trên) | có (lãnh đạo) | sống dưới quyền (người cai trị) | cài đặt (chủ tịch) | nhờ ai làm gì","to receive | to get | to accept | to take | to buy | to eat | to drink | to be crowned with | to wear (on one's head) | to have (on top) | to have (as one's leader) | to live under (a ruler) | to install (a president) | to get someone to do something","","0","jmdict","1587290","CC BY-SA 3.0 — verify at edrdg.org before production use","JMdict/EDRDG","お先にいただきます。","おさきにいただきます。","Tôi xin phép ăn trước.","I will eat first.","ai_draft","jmdict_ai"
"今まで","いままで","","N5","adv","cho đến bây giờ | đến giờ này | cho đến hiện tại | đến thời điểm này | cho đến nay","until now | till now | up to now | up to the present | so far","","0","jmdict","1587590","CC BY-SA 3.0 — verify at edrdg.org before production use","JMdict/EDRDG","今まで知りませんでした。","いままでしりませんでした。","Cho đến giờ tôi không biết.","I didn't know until now.","ai_draft","jmdict_ai"
"選ぶ","えらぶ","","N5","v5b|vt","chọn | lựa chọn | chọn ra","to choose | to select | to pick (out)","","0","jmdict","1588730","CC BY-SA 3.0 — verify at edrdg.org before production use","JMdict/EDRDG","好きなものを選んでください。","すきなものをえらんでください。","Hãy chọn thứ bạn thích.","Please choose what you like.","ai_draft","jmdict_ai"
"落とす","おとす","","N5","v5s|vt","làm rơi | mất | để rơi | chiếu (ánh sáng) | nhìn xuống | rót (chất lỏng) | để lại phía sau | chùi sạch (bẩn, phấn, sơn) | tẩy (ví dụ vết bẩn) | mất | tiêu tiền ở nơi nào đó | bỏ sót | loại ra | để lọt qua | thua (trận đấu) | từ chối (ứng viên) | trượt (môn học) | đánh bại (trong bầu cử) | hạ xuống (ví dụ vai hoặc giọng) | giảm (ví dụ sản xuất hoặc cân nặng) | làm giảm chất lượng | giảm hạng | nói xấu | xem nhẹ | sa vào hoàn cảnh khó khăn | rơi vào (ví dụ tình huống khó xử hoặc tội lỗi) | giành được | hạ gục | chiếm (trại, lâu đài địch) | thuyết phục | đưa về trạng thái đầu hàng | tải về | sao chép | làm ngất | kết thúc câu chuyện","to drop | to lose | to let fall | to shed (light) | to cast (one's gaze) | to pour in (liquid) | to leave behind | to clean off (dirt, makeup, paint, etc.) | to remove (e.g. stains or facial hair) | to lose | to spend money at a certain place | to omit | to leave out | to secretly let escape | to lose (a match) | to reject (an applicant) | to fail (a course) | to defeat (in an election) | to lower (e.g. shoulders or voice) | to lessen (e.g. production or body weight) | to worsen (quality) | to reduce (e.g. rank or popularity) | to speak badly of | to make light of | to fall into straitened circumstances | to fall into (e.g. a dilemma or sin) | to make one's own | to have one's bid accepted | to force surrender | to take (e.g. an enemy camp or castle) | to forcefully convince | to press for a confession | to deal with | to download | to copy from a computer to another medium | to make someone swoon (judo) | to finish a story (e.g. with the punch line) | to finish (a period, e.g. of fasting) | to win over | to seduce | to conquer (unwillingness)","","0","jmdict","1589260","CC BY-SA 3.0 — verify at edrdg.org before production use","JMdict/EDRDG","財布を落としました。","さいふをおとしました。","Tôi đánh rơi ví.","I dropped my wallet.","ai_draft","jmdict_ai"
"ラーメン","ラーメン","","N5","n","mì ramen | mì Nhật","rigid frame","","0","jmdict","2207500","CC BY-SA 3.0 — verify at edrdg.org before production use","JMdict/EDRDG","ラーメンを食べます。","ラーメンをたべます。","Tôi ăn mì ramen.","I eat ramen.","ai_draft","jmdict_ai"
"決まる","きまる","","N5","v5r|vi","được quyết định | được dàn xếp | được cố định | được sắp xếp | không thay đổi | luôn như vậy | cố định | quy định sẵn | theo định mệnh | theo quy ước | theo phong tục | phổ biến | thực hiện tốt (trong thể thao) | suôn sẻ | thành công | trúng (cú đấm) | trông đẹp (quần áo) | trông sắc sảo | hợp với mình | cố định (kiểu tóc) | đứng yên (trong tư thế kabuki) | lên cao (với ma túy)","to be decided | to be settled | to be fixed | to be arranged | to be unchanging | to be the same (as always) | to be fixed | to be set | to be a fixed rule | to be destined | to be a convention | to be a custom | to be common knowledge | to be well executed (of a manoeuvre in a sport, game, etc.) | to go well | to succeed | to connect (of a punch) | to look good (of clothing) | to look sharp | to suit one | to be held in place (of a hairdo) | to be struck and held (of a pose in kabuki) | to get high (on drugs)","","0","jmdict","1591420","CC BY-SA 3.0 — verify at edrdg.org before production use","JMdict/EDRDG","日程が決まりました。","にっていがきまりました。","Lịch trình đã được quyết định.","The schedule has been decided.","ai_draft","jmdict_ai"
"気持ち","きもち","","N5","n|adv","cảm giác | cảm xúc | tâm trạng | trạng thái tâm lý | sự sẵn sàng | thái độ | suy nghĩ | tình cảm | sự quan tâm | sự chu đáo | lòng biết ơn | hơi | một chút | một tí","feeling | sensation | mood | state of mind | preparedness | readiness | attitude | thought | sentiment | consideration | solicitude | gratitude | slightly | a bit | a little","","0","jmdict","1591430","CC BY-SA 3.0 — verify at edrdg.org before production use","JMdict/EDRDG","気持ちを伝えます。","きもちをつたえます。","Tôi nói lên cảm xúc.","I express my feelings.","ai_draft","jmdict_ai"
"交差点","こうさてん","","N5","n","ngã tư | giao lộ","crossing | intersection","","0","jmdict","1592970","CC BY-SA 3.0 — verify at edrdg.org before production use","JMdict/EDRDG","交差点を左に曲がります。","こうさてんをひだりにまがります。","Rẽ trái ở ngã tư.","Turn left at the intersection.","ai_draft","jmdict_ai"
"もう少し","もうすこし","","N5","exp","thêm một chút | thêm một lúc","a bit more | a bit longer","","0","jmdict","2005870","CC BY-SA 3.0 — verify at edrdg.org before production use","JMdict/EDRDG","もう少し待ってください。","もうすこしまってください。","Hãy đợi thêm một chút.","Please wait a little more.","ai_draft","jmdict_ai"
"夕ご飯","ゆうごはん","","N5","n","bữa tối | cơm tối | bữa cơm tối","evening meal | dinner | supper","","0","jmdict","2013470","CC BY-SA 3.0 — verify at edrdg.org before production use","JMdict/EDRDG","夕ご飯を食べましょう。","ゆうごはんをたべましょう。","Hãy ăn cơm tối.","Let's have dinner.","ai_draft","jmdict_ai"
"日","か","","N5","n-suf|ctr","ngày (của tháng) | đơn vị đếm ngày","day of month | counter for days","","0","jmdict","2083110","CC BY-SA 3.0 — verify at edrdg.org before production use","JMdict/EDRDG","","","","","ai_draft","jmdict_ai"
"お寺","おてら","","N5","n","chùa | nhà sư","temple | monk","","0","jmdict","2271230","CC BY-SA 3.0 — verify at edrdg.org before production use","JMdict/EDRDG","お寺に行きます。","おてらにいきます。","Tôi đến chùa.","I go to the temple.","ai_draft","jmdict_ai"
"直る","なおる","","N5","v5r|vi","được sửa | được sửa chữa | được khắc phục | trở về bình thường | bình phục (ví dụ tính nóng) | được khôi phục | cải thiện | tốt lên | trở nên đúng | được sửa đúng | được chỉnh lại | tự chữa lành | tự khỏi | ngồi đúng tư thế | được thăng tiến | tăng hạng | được tha tội","to get mended | to be repaired | to be fixed | to return to normal | to recover (e.g. one's temper) | to be restored | to improve | to rally | to come right | to be corrected | to get put right | to be rectified | to come right | to cure (itself) | to get cured | to sit properly | to be promoted | to rise | to have one's crimes forgiven","","0","jmdict","2846390","CC BY-SA 3.0 — verify at edrdg.org before production use","JMdict/EDRDG","パソコンが直りました。","パソコンがなおりました。","Máy tính đã được sửa.","The computer is fixed.","ai_draft","jmdict_ai"
"安全","あんぜん","","N5","n|adj-na","an toàn | bảo mật","safety | security","","0","jmdict","1153930","CC BY-SA 3.0 — verify at edrdg.org before production use","JMdict/EDRDG","安全に気をつけてください。","あんぜんにきをつけてください。","Hãy chú ý an toàn.","Please be careful of safety.","ai_draft","jmdict_ai"
"暗い","くらい","","N5","adj-i","tối | ảm đạm | u ám | chán nản | sầu muộn | buồn bã (tâm trạng) | tối màu | mờ nhạt | xui xẻo | tối tăm (ví dụ quá khứ) | đáng ngờ | khó thành công | vô vọng | không hứa hẹn | không quen (với) | không biết (về)","dark | gloomy | murky | depressed | dispirited | down in the dumps | dark (mood) | dark (in colour) | dull | ill-boding | dark (e.g. past) | suspicious | unlikely (to succeed) | hopeless | unpromising | unfamiliar (with) | ignorant (of)","","0","jmdict","1154330","CC BY-SA 3.0 — verify at edrdg.org before production use","JMdict/EDRDG","部屋が暗いです。","へやがくらいです。","Phòng tối quá.","The room is dark.","ai_draft","jmdict_ai"
"一月","ひとつき","","N5","n","một tháng","one month","","0","jmdict","1162130","CC BY-SA 3.0 — verify at edrdg.org before production use","JMdict/EDRDG","","","","","ai_draft","jmdict_ai"
"汚い","きたない","","N5","adj-i","bẩn | dơ bẩn | ô uế | không sạch sẽ | lộn xộn | bừa bộn | cẩu thả (ví dụ chữ viết) | thô tục (ngôn ngữ) | bẩn thỉu | thô lỗ | thô thiển | hèn hạ | đê tiện | bẩn tính | keo kiệt | tham lam","dirty | filthy | foul | unclean | disordered | messy | untidy | poor (e.g. handwriting) | indecent (language, etc.) | dirty | vulgar | coarse | dastardly | mean | base | underhanded | stingy | greedy","","0","jmdict","1178940","CC BY-SA 3.0 — verify at edrdg.org before production use","JMdict/EDRDG","手が汚いです。","てがきたないです。","Tay bẩn quá.","My hands are dirty.","ai_draft","jmdict_ai"
"簡単","かんたん","","N5","adj-na|n","đơn giản | dễ | không phức tạp | ngắn gọn | nhanh chóng | nhẹ","simple | easy | uncomplicated | brief | quick | light","","0","jmdict","1214330","CC BY-SA 3.0 — verify at edrdg.org before production use","JMdict/EDRDG","簡単な問題です。","かんたんなもんだいです。","Đây là bài toán đơn giản.","This is a simple problem.","ai_draft","jmdict_ai"
"危険","きけん","","N5","n|adj-na","nguy hiểm | nguy hiểm | hiểm nguy | rủi ro","danger | peril | hazard | risk","","0","jmdict","1218560","CC BY-SA 3.0 — verify at edrdg.org before production use","JMdict/EDRDG","危険です！","きけんです！","Nguy hiểm!","It is dangerous!","ai_draft","jmdict_ai"
"失敗","しっぱい","","N5","n|vs|vt|vi","thất bại | sai lầm | nhầm lẫn","failure | mistake | blunder","","0","jmdict","1320140","CC BY-SA 3.0 — verify at edrdg.org before production use","JMdict/EDRDG","失敗しても大丈夫です。","しっぱいしてもだいじょうぶです。","Thất bại cũng không sao.","It's okay even if you fail.","ai_draft","jmdict_ai"
"失礼","しつれい","","N5","n|vs|vi|adj-na|exp|vt","thô lỗ | bất lịch sự | xin lỗi | tạm biệt | xin phép ra về | thô lỗ","discourtesy | impoliteness | excuse me | goodbye | to leave | to be rude","","0","jmdict","1320230","CC BY-SA 3.0 — verify at edrdg.org before production use","JMdict/EDRDG","失礼します。","しつれいします。","Xin phép tôi ra về.","Excuse me, I will be leaving.","ai_draft","jmdict_ai"
"出発","しゅっぱつ","","N5","n|vs|vi","khởi hành | xuất phát | lên đường","departure | leaving | setting off","","0","jmdict","1340000","CC BY-SA 3.0 — verify at edrdg.org before production use","JMdict/EDRDG","出発は何時ですか。","しゅっぱつはなんじですか。","Mấy giờ khởi hành?","What time is the departure?","ai_draft","jmdict_ai"
"心配","しんぱい","","N5","n|vs|vt|adj-na","lo lắng | lo ngại | lo âu | bất an | sợ hãi | quan tâm | giúp đỡ | hỗ trợ","worry | concern | anxiety | uneasiness | fear | care | help | aid | assistance","","0","jmdict","1360930","CC BY-SA 3.0 — verify at edrdg.org before production use","JMdict/EDRDG","心配しないでください。","しんぱいしないでください。","Đừng lo lắng.","Please don't worry.","ai_draft","jmdict_ai"
"深い","ふかい","","N5","adj-i","sâu | sâu sắc | dày đặc | dày | thân thiết (quan hệ) | mãnh liệt | mạnh | muộn","deep | profound | dense | thick | close (relationship) | intense | strong | late","","0","jmdict","1362640","CC BY-SA 3.0 — verify at edrdg.org before production use","JMdict/EDRDG","この川は深いです。","このかわはふかいです。","Con sông này sâu.","This river is deep.","ai_draft","jmdict_ai"
"真面目","まじめ","","N5","adj-na|n","nghiêm túc | cần cù | đứng đắn | trang nghiêm | thành thật | chân thành","serious | earnest | sober | grave | honest | sincere","","0","jmdict","1364360","CC BY-SA 3.0 — verify at edrdg.org before production use","JMdict/EDRDG","真面目に勉強します。","まじめにべんきょうします。","Tôi học hành nghiêm túc.","I study seriously.","ai_draft","jmdict_ai"
"成功","せいこう","","N5","n|vs|vi","thành công | đạt được | thành đạt (trong cuộc sống) | thịnh vượng","success | achievement | succeeding (in life) | (worldly) success | prosperity","","0","jmdict","1375690","CC BY-SA 3.0 — verify at edrdg.org before production use","JMdict/EDRDG","成功しました！","せいこうしました！","Đã thành công!","I succeeded!","ai_draft","jmdict_ai"
"正しい","ただしい","","N5","adj-i","đúng | chính xác | đúng đắn | ngay thẳng | công bằng | thành thật | trung thực | hợp pháp","right | correct | proper | righteous | just | honest | truthful | lawful","","0","jmdict","1376600","CC BY-SA 3.0 — verify at edrdg.org before production use","JMdict/EDRDG","正しい答えです。","ただしいこたえです。","Đó là câu trả lời đúng.","That is the correct answer.","ai_draft","jmdict_ai"
"正確","せいかく","","N5","adj-na|n","chính xác | đúng | chính xác | chính xác tuyệt đối","accurate | correct | precise | exact","","0","jmdict","1376760","CC BY-SA 3.0 — verify at edrdg.org before production use","JMdict/EDRDG","正確に言ってください。","せいかくにいってください。","Hãy nói chính xác.","Please say it accurately.","ai_draft","jmdict_ai"
"正直","しょうじき","","N5","adj-na|n|adv","thành thật | thẳng thắn | cởi mở | thật thà | một cách thành thật | thật ra","honest | frank | candid | straightforward | honestly | frankly","","0","jmdict","1377590","CC BY-SA 3.0 — verify at edrdg.org before production use","JMdict/EDRDG","正直に言います。","しょうじきにいいます。","Tôi nói thật.","I will be honest.","ai_draft","jmdict_ai"
"浅い","あさい","","N5","adj-i","nông | nông cạn | nhẹ (vết thương) | nhẹ (giấc ngủ) | nhạt (màu) | không đủ (kiến thức) | ngắn (thời gian) | sớm | trẻ","shallow | superficial | slight (wound) | light (sleep) | pale (colour) | inadequate (knowledge) | short (time) | early | young","","0","jmdict","1390800","CC BY-SA 3.0 — verify at edrdg.org before production use","JMdict/EDRDG","","","","","ai_draft","jmdict_ai"
"素直","すなお","","N5","adj-na|n","ngoan ngoãn | hiền lành | dễ bảo | tự nhiên | thành thật | thẳng thắn | cởi mở (với cảm xúc) | thẳng (ví dụ tóc) | không đặc biệt | không màu mè | tiêu chuẩn | gọn gàng (ví dụ chữ viết)","obedient | meek | docile | unaffected | honest | frank | upfront (about one's feelings) | straight (e.g. hair) | without peculiarity | without mannerisms | standard | neat (e.g. handwriting)","","0","jmdict","1397340","CC BY-SA 3.0 — verify at edrdg.org before production use","JMdict/EDRDG","素直な子供ですね。","すなおなこどもですね。","Đứa trẻ ngoan nhỉ.","What an obedient child.","ai_draft","jmdict_ai"
"相談","そうだん","","N5","n|vs|vt","tư vấn | thảo luận | bàn bạc | hỏi ý kiến (ai đó)","consultation | discussion | discussing | asking (someone) for advice","","0","jmdict","1401210","CC BY-SA 3.0 — verify at edrdg.org before production use","JMdict/EDRDG","相談してもいいですか。","そうだんしてもいいですか。","Tôi có thể xin lời khuyên không?","May I consult you?","ai_draft","jmdict_ai"
"太い","ふとい","","N5","adj-i","to | dày | trầm (giọng) | dày | trầm | dám làm | vô liêm sỉ | trơ trẽn | táo bạo","fat | thick | deep (of a voice) | thick | sonorous | daring | shameless | brazen | audacious","","0","jmdict","1408180","CC BY-SA 3.0 — verify at edrdg.org before production use","JMdict/EDRDG","太い木ですね。","ふといきですね。","Cái cây to nhỉ.","What a thick tree.","ai_draft","jmdict_ai"
"注文","ちゅうもん","","N5","n|vs|vt","đặt hàng (một món) | yêu cầu | đòi hỏi | điều kiện","order (for an item) | request | demand | condition","","0","jmdict","1426650","CC BY-SA 3.0 — verify at edrdg.org before production use","JMdict/EDRDG","注文してもいいですか。","ちゅうもんしてもいいですか。","Tôi có thể gọi món không?","May I place an order?","ai_draft","jmdict_ai"
"珍しい","めずらしい","","N5","adj-i","hiếm | không phổ biến | bất thường | tò mò | mới lạ | mới | đẹp | hay | tuyệt | quý","rare | uncommon | unusual | curious | new | novel | fine | nice | splendid | precious","","0","jmdict","1431850","CC BY-SA 3.0 — verify at edrdg.org before production use","JMdict/EDRDG","珍しい鳥ですね。","めずらしいとりですね。","Con chim hiếm nhỉ.","What a rare bird.","ai_draft","jmdict_ai"
"痛い","いたい","","N5","adj-i","đau | ê | xấu hổ | ngại ngùng","painful | sore | cringy | embarrassing","","0","jmdict","1432680","CC BY-SA 3.0 — verify at edrdg.org before production use","JMdict/EDRDG","頭が痛いです。","あたまがいたいです。","Tôi đau đầu.","I have a headache.","ai_draft","jmdict_ai"
"到着","とうちゃく","","N5","n|vs|vi","đến nơi | đến | tới","arrival","","0","jmdict","1449870","CC BY-SA 3.0 — verify at edrdg.org before production use","JMdict/EDRDG","東京に到着しました。","とうきょうにとうちゃくしました。","Tôi đã đến Tokyo.","I arrived in Tokyo.","ai_draft","jmdict_ai"
