word,reading,romaji,jlpt_level,pos,meaning_vi,meaning_en,tags,frequency,source,source_id,license,attribution,example_jp,example_reading,example_vi,example_en,review_status,meaning_source
"だから","だから","","N5","conj|exp","vì vậy | cho nên | theo đó | do đó | vì lý do đó | đó là lý do tại sao | vì lý do đó | như tôi đã nói | tôi đã nói rồi đấy","so | therefore | accordingly | consequently | on those grounds | that is why | for that reason | like I said | I told you already","","0","jmdict","1007310","CC BY-SA 3.0 — verify at edrdg.org before production use","JMdict/EDRDG","雨が降っているから、だから出かけません。","あめがふっているから、だからでかけません。","Trời đang mưa, vì vậy tôi không đi ra ngoài.","It's raining, so I'm not going out.","ai_draft","jmdict_ai"
"ちゃんと","ちゃんと","","N5","adv|vs","chăm chỉ | nghiêm túc | thành thật | đáng tin cậy | vững chắc | đúng đắn | hoàn hảo | đúng cách | chính xác | có trật tự | đúng giờ | đều đặn | an toàn | trong tình trạng tốt | đầy đủ | thỏa đáng | nhanh chóng","diligently | seriously | earnestly | reliably | steadily | legitimately | perfectly | properly | exactly | orderly | punctually | regularly | safely | in good condition | sufficiently | satisfactorily | quickly","","0","jmdict","1007720","CC BY-SA 3.0 — verify at edrdg.org before production use","JMdict/EDRDG","ちゃんと食べてください。","ちゃんとたべてください。","Hãy ăn đúng cách.","Please eat properly.","ai_draft","jmdict_ai"
"どうも","どうも","","N5","int|adv","cảm ơn | cảm ơn | rất (cảm ơn) | rất (xin lỗi) | khá (tiếc) | khá | thực sự | phần lớn | bằng cách nào đó | dù không muốn | dù cố gắng thế nào | dù cố gắng thế nào đi nữa | lời chào | xin chào | tạm biệt","thank you | thanks | much (thanks) | very (sorry) | quite (regret) | quite | really | mostly | somehow | in spite of oneself | try as one might | no matter how hard one may try (to, not to) | greetings | hello | goodbye","","0","jmdict","1009000","CC BY-SA 3.0 — verify at edrdg.org before production use","JMdict/EDRDG","どうもありがとうございます。","どうもありがとうございます。","Cảm ơn bạn rất nhiều.","Thank you very much.","ai_draft","jmdict_ai"
"はっきり","はっきり","","N5","adv|adv-to|vs","rõ ràng | rõ ràng | rõ nét | trở nên rõ ràng | chắc chắn | chắc chắn | chính xác | trở nên rõ ràng | sáng tỏ","clearly | plainly | distinctly | to be clear | to be definite | to be certain | to be exact | to become clear | to clear up","","0","jmdict","1010150","CC BY-SA 3.0 — verify at edrdg.org before production use","JMdict/EDRDG","はっきり話してください。","はっきりはなしてください。","Hãy nói rõ ràng.","Please speak clearly.","ai_draft","jmdict_ai"
"一","いち","","N5","num|pref|adj-no|suf|n|n-pref","một | 1 | tốt nhất | đầu tiên | hàng đầu | bắt đầu | khởi đầu | một (đơn lẻ) | một (trong nhiều) | quân át | dây thấp nhất (trên đàn shamisen, v.v.)","one | 1 | best | first | foremost | beginning | start | a (single) | one (of many) | ace | bottom string (on a shamisen, etc.)","","0","jmdict","1160790","CC BY-SA 3.0 — verify at edrdg.org before production use","JMdict/EDRDG","一番好きな食べ物は何ですか。","いちばんすきなたべものはなんですか。","Món ăn bạn thích nhất là gì?","What is your favorite food?","ai_draft","jmdict_ai"
"押す","おす","","N5","v5s|vt|vi","đẩy | thúc | xô | ấn (xuống) | nhấn (ví dụ nút) | gây áp lực lên | đóng dấu (ví dụ tên) | đóng dấu niêm phong | dán (ví dụ vàng lá) | thúc ép (ai đó điều gì) | ép | gây áp lực lên (ai đó) | áp đảo | lấn át | đặt (ai đó) dưới áp lực | vượt trội hơn | tiến tới (với chính sách, kế hoạch, v.v.) | tiến hành | kiên trì | làm ... mặc dù ... | thách thức | đương đầu | gạt sang một bên | đảm bảo chắc chắn | bị trễ tiến độ | đẩy quân | tiến quân bằng cách đẩy vào quân đối thủ","to push | to thrust | to shove | to press (down) | to push (e.g. a button) | to exert pressure on | to stamp (e.g. one's name) | to affix (a seal) | to affix (e.g. gold leaf) | to push (someone for something) | to press | to put pressure on (someone) | to overwhelm | to overpower | to put (someone) under pressure | to be superior to | to push ahead (with a policy, plan, etc.) | to proceed | to stick to | to do ... in spite of ... | to defy | to brave | to push aside | to make sure | to fall behind schedule | to push | to extend one's stones forward by pushing against opponent's stones","","0","jmdict","1180470","CC BY-SA 3.0 — verify at edrdg.org before production use","JMdict/EDRDG","ボタンを押してください。","ボタンをおしてください。","Hãy nhấn nút.","Please press the button.","ai_draft","jmdict_ai"
"下げる","さげる","","N5","v1|vt","treo | treo lơ lửng | đeo (ví dụ đồ trang trí) | hạ xuống | giảm | kéo xuống | hạ cấp | lùi lại | kéo lùi | dọn (đĩa) | dọn (thức ăn, v.v. khỏi bàn hoặc bàn thờ) | tiếp tục chơi sau khi tạo được tổ hợp tính điểm với bài đã bắt","to hang | to suspend | to wear (e.g. decoration) | to lower | to reduce | to bring down | to demote | to move back | to pull back | to clear (plates) | to remove (food, etc. from table or altar) | to keep on playing after one has formed a scoring combination with captured cards","","0","jmdict","1184170","CC BY-SA 3.0 — verify at edrdg.org before production use","JMdict/EDRDG","値段を下げてください。","ねだんをさげてください。","Hãy giảm giá xuống.","Please lower the price.","ai_draft","jmdict_ai"
"強い","つよい","","N5","adj-i","mạnh mẽ | mạnh | có năng lực | bá đạo | cứng rắn | mạnh mẽ | vạm vỡ | hùng mạnh | khỏe mạnh | cứng cáp | giỏi (về) | lành nghề | am hiểu | có thể xử lý | biết cách đối phó (với) | bền (với) | kháng (với) | kiên cường | vững chắc | cứng nhắc | chắc chắn | mãnh liệt | mạnh | dữ dội | cao | đáng tin cậy | đáng tin","strong | potent | competent | domineering | tough | strong | brawny | powerful | healthy | rugged | good (at) | skilled | knowledgeable | being able to handle | know how to deal (with) | durable (against) | resistant (to) | resilient | firm | rigid | solid | intense | strong | fierce | high | dependable | trustworthy","","0","jmdict","1236070","CC BY-SA 3.0 — verify at edrdg.org before production use","JMdict/EDRDG","彼はとても強いです。","かれはとてもつよいです。","Anh ấy rất mạnh mẽ.","He is very strong.","ai_draft","jmdict_ai"
"覚える","おぼえる","","N5","v1|vt","ghi nhớ | ghi nhớ | thuộc lòng | học thuộc | ghi nhớ trong tâm | nhớ | học | tiếp thu | nắm được | cảm thấy | nghĩ | xem xét","to memorize | to memorise | to commit to memory | to learn by heart | to bear in mind | to remember | to learn | to pick up | to acquire | to feel | to think | to regard","","0","jmdict","1206050","CC BY-SA 3.0 — verify at edrdg.org before production use","JMdict/EDRDG","単語を覚えます。","たんごをおぼえます。","Tôi ghi nhớ các từ vựng.","I memorize vocabulary.","ai_draft","jmdict_ai"
"泣く","なく","","N5","v5k|vi|vt","khóc | rơi nước mắt | khóc lóc | nức nở | chịu đựng (từ) | bị làm phiền (bởi) | đối mặt gian khổ | chấp nhận (yêu cầu vô lý, mất mát, v.v.) | làm miễn cưỡng | hy sinh | không xứng với tên gọi | chịu thiệt (về danh tiếng) | bị hủy hoại | bị xấu hổ | than thở | than vãn | than khóc","to cry | to shed tears | to weep | to sob | to suffer (from) | to be troubled (by) | to face hardship | to accept (an unreasonable request, loss, etc.) | to do reluctantly | to make sacrifices | to be not worth the name | to suffer (of a reputation) | to be spoiled | to be put to shame | to lament | to bemoan | to bewail","","0","jmdict","1229840","CC BY-SA 3.0 — verify at edrdg.org before production use","JMdict/EDRDG","赤ちゃんが泣いています。","あかちゃんがないています。","Em bé đang khóc.","The baby is crying.","ai_draft","jmdict_ai"
"胸","むね","","N5","n","ngực | vú | ngực | lồng ngực | ngực | tim | phổi | bụng | trái tim | tâm trí | cảm xúc","chest | breast | breasts | bosom | bust | heart | lungs | stomach | heart | mind | feelings","","0","jmdict","1237820","CC BY-SA 3.0 — verify at edrdg.org before production use","JMdict/EDRDG","","","","","ai_draft","jmdict_ai"
"軽い","かるい","","N5","adj-i","nhẹ (không nặng) | cảm giác nhẹ (ít kháng cự, dễ di chuyển) | nhẹ chân | dễ dàng | nhanh nhẹn | linh hoạt | không nghiêm túc | nhỏ | không quan trọng | tầm thường | nhỏ | ít | nhẹ nhàng | mềm mại | dễ | vui vẻ (ví dụ truyện cười) | đơn giản | đơn giản | không phân biệt","light (i.e. not heavy) | feeling light (i.e. offering little resistance, moving easily) | light (i.e. of foot) | effortless | nimble | agile | non-serious | minor | unimportant | trivial | slight | small | gentle | soft | easy | lighthearted (e.g. joke) | easy | simple | indiscriminate","","0","jmdict","1252560","CC BY-SA 3.0 — verify at edrdg.org before production use","JMdict/EDRDG","このカバンはとても軽いです。","このカバンはとてもかるいです。","Cái túi này rất nhẹ.","This bag is very light.","ai_draft","jmdict_ai"
"見せる","みせる","","N5","v1|vt|aux-v","chỉ ra | trưng bày | làm (gì/ai đó) trông ... | tạo vẻ ngoài của ... | làm (gì đó) đáng xem | giải trí | cho (gì đó) được xem bởi chuyên gia | cho (đồ cổ, v.v.) được thẩm định | cho (vết thương, người, v.v.) được khám bởi bác sĩ | đưa (ai đó) đến bác sĩ | phô trương (làm gì) | làm theo cách nổi bật | làm trước mặt người khác | quyết tâm làm | làm bằng mọi giá | cho người khác thấy rằng mình sẽ ...","to show | to display | to make (something or someone) look ... | to present an appearance of ... | to make (something) worth watching | to be entertaining | to have (something) looked at (by a specialist) | to have (an antique, etc.) appraised | to have (an injury, person, etc.) looked at (by a doctor) | to take (someone) to a doctor | to make a show of (doing) | to do in a conspicuous manner | to do in view of others | to resolve to do | to do at any cost | to show others that one will ...","","0","jmdict","1259210","CC BY-SA 3.0 — verify at edrdg.org before production use","JMdict/EDRDG","写真を見せてください。","しゃしんをみせてください。","Hãy cho tôi xem ảnh.","Please show me the photo.","ai_draft","jmdict_ai"
"好き","すき","","N5","adj-na|n","thích | yêu thích | theo sở thích | theo khẩu vị | được ưa thích | yêu thích | thích (theo nghĩa tình cảm) | đang yêu | người yêu | sự thích nhất thời | sự kỳ dị | theo ý thích | tùy ý | dâm dục | ham muốn | tục tĩu","liking | being fond of | to one's liking | to one's taste | preferred | favourite | liking (romantically) | being in love with | beloved | faddism | eccentricity | as one likes | as it suits one | lecherous | lustful | salacious","","0","jmdict","1277450","CC BY-SA 3.0 — verify at edrdg.org before production use","JMdict/EDRDG","日本語が好きです。","にほんごがすきです。","Tôi thích tiếng Nhật.","I like Japanese.","ai_draft","jmdict_ai"
"止まる","とまる","","N5","v5r|vi","dừng lại (di chuyển) | đến dừng | ngừng (làm, hoạt động, được cung cấp) | dừng hẳn | chấm dứt | bị dừng | bị đình chỉ | đáp xuống | đậu trên","to stop (moving) | to come to a stop | to stop (doing, working, being supplied) | to come to a halt | to cease | to be stopped | to be suspended | to alight | to perch on","","0","jmdict","1310620","CC BY-SA 3.0 — verify at edrdg.org before production use","JMdict/EDRDG","バスが止まります。","バスがとまります。","Xe buýt dừng lại.","The bus stops.","ai_draft","jmdict_ai"
"切る","きる","","N5","v5r|vt|suf","cắt | cắt xuyên qua | thực hiện (phẫu thuật) | cắt đứt (kết nối, quan hệ) | tắt (ví dụ đèn) | kết thúc (ví dụ cuộc trò chuyện) | cúp (điện thoại) | ngắt kết nối | đục lỗ (vé) | xé rời (cuống vé) | mở (gì đó được niêm phong) | bắt đầu | đặt (giới hạn) | làm (gì đó) trong thời gian nhất định | phát hành (séc, phiếu, v.v.) | giảm | giảm bớt | giảm giá | rũ sạch (nước, v.v.) | để ráo nước | để thoát nước | qua | băng qua | phê bình gay gắt | hành động quyết đoán | làm (gì đó) nổi bật | đi trước | tạo (biểu cảm khuôn mặt nhất định, trong kabuki) | rẽ (xe, vô lăng, v.v.) | xoáy (bóng) | uốn cong | cắt | xào bài | bỏ bài | sa thải | cho nghỉ việc | buông tha | trục xuất | khai trừ | đào (rãnh) | cắt (khuôn, trên máy in ronéo) | chặn | cắt (kết nối giữa hai nhóm) | đánh lửa (bằng cọ gỗ hoặc đập kim loại vào đá) | vẽ (hình dạng) trong không khí (bằng kiếm, v.v.) | làm hoàn toàn | hoàn thành làm | hoàn toàn ... | toàn bộ ... | vô cùng ... | làm rõ ràng | làm quyết đoán | làm kiên quyết","to cut | to cut through | to perform (surgery) | to sever (connections, ties) | to turn off (e.g. the light) | to terminate (e.g. a conversation) | to hang up (the phone) | to disconnect | to punch (a ticket) | to tear off (a stub) | to open (something sealed) | to start | to set (a limit) | to do (something) in less or within a certain time | to issue (cheques, vouchers, etc.) | to reduce | to decrease | to discount | to shake off (water, etc.) | to let drip-dry | to let drain | to cross | to traverse | to criticize sharply | to act decisively | to do (something noticeable) | to go first | to make (certain facial expressions, in kabuki) | to turn (vehicle, steering wheel, etc.) | to curl (a ball) | to bend | to cut | to shuffle (cards) | to discard a tile | to dismiss | to sack | to let go | to expel | to excommunicate | to dig (a groove) | to cut (a stencil, on a mimeograph) | to trump | to cut (the connection between two groups) | to start a fire (with wood-wood friction or by striking a metal against stone) | to draw (a shape) in the air (with a sword, etc.) | to do completely | to finish doing | to be completely ... | to be totally ... | to be terribly ... | to do clearly | to do decisively | to do firmly","","0","jmdict","1384830","CC BY-SA 3.0 — verify at edrdg.org before production use","JMdict/EDRDG","パンを切ります。","パンをきります。","Tôi cắt bánh mì.","I cut the bread.","ai_draft","jmdict_ai"
"洗う","あらう","","N5","v5u|vt","rửa | làm sạch | tráng | tìm hiểu | điều tra | thanh lọc (tâm hồn) | rửa (ví dụ bãi biển) | rửa qua (ví dụ boong tàu) | quét qua","to wash | to cleanse | to rinse | to inquire into | to investigate | to purify (one's heart) | to lave (e.g. shore) | to wash over (e.g. deck) | to sweep","","0","jmdict","1390930","CC BY-SA 3.0 — verify at edrdg.org before production use","JMdict/EDRDG","手を洗います。","てをあらいます。","Tôi rửa tay.","I wash my hands.","ai_draft","jmdict_ai"
"草","くさ","","N5","n|pref|exp","cỏ | cỏ dại | thảo mộc | rơm rạ | ninja | cần sa | cần sa | không chính hãng | dưới tiêu chuẩn | LOL | haha","grass | weed | herb | thatch | ninja | marijuana | cannabis | not genuine | substandard | LOL | haha","","0","jmdict","1401910","CC BY-SA 3.0 — verify at edrdg.org before production use","JMdict/EDRDG","庭の草を取ります。","にわのくさをとります。","Tôi nhổ cỏ trong sân.","I pull the weeds in the garden.","ai_draft","jmdict_ai"
"送る","おくる","","N5","v5r|vt","gửi | điều phái | chuyển tiếp | truyền đi | vận chuyển | chuyển tiền | tiễn (ai đó) | hộ tống | đi cùng | đưa đi | từ biệt (người đã khuất) | nói lời tạm biệt | chôn cất | trải qua (thời gian) | qua đi | sống (một cuộc sống) | sống | truyền đi (tiếp theo) | đẩy (người chạy) lên | thêm okurigana","to send | to dispatch | to forward | to transmit | to ship | to remit | to see (someone) off | to escort | to accompany | to take | to bid farewell to (the departed) | to say goodbye to | to bury | to spend (time) | to pass | to lead (a life) | to live | to pass (on, along) | to advance (a runner) | to affix (okurigana)","","0","jmdict","1402730","CC BY-SA 3.0 — verify at edrdg.org before production use","JMdict/EDRDG","メールを送ります。","メールをおくります。","Tôi gửi email.","I send an email.","ai_draft","jmdict_ai"
"多い","おおい","","N5","adj-i","nhiều | đông đảo | rất nhiều | số lượng lớn | số lượng lớn | rất nhiều | nhiều | thường xuyên | phổ biến","many | numerous | a lot | large amount of | large quantity of | a lot | much | frequent | common","","0","jmdict","1407460","CC BY-SA 3.0 — verify at edrdg.org before production use","JMdict/EDRDG","今日は人が多いです。","きょうはひとがおおいです。","Hôm nay có nhiều người.","There are many people today.","ai_draft","jmdict_ai"
"大丈夫","だいじょうぶ","","N5","adj-na|adv|int|n","an toàn | bảo đảm | lành mạnh | không có vấn đề | không sợ hãi | ổn | ổn thôi | OK | được rồi | chắc chắn | chắc chắn | không nghi ngờ | không cần đâu | tôi ổn rồi | không sao đâu | người đàn ông vĩ đại | người đàn ông xuất sắc","safe | secure | sound | problem-free | without fear | all right | alright | OK | okay | certainly | surely | undoubtedly | no thanks | I'm good | that's alright | great man | fine figure of a man","","0","jmdict","1414150","CC BY-SA 3.0 — verify at edrdg.org before production use","JMdict/EDRDG","大丈夫ですか？","だいじょうぶですか？","Bạn có ổn không?","Are you OK?","ai_draft","jmdict_ai"
"大変","たいへん","","N5","adv|adj-na|n","rất | vô cùng | khủng khiếp | kinh khủng | to lớn | khổng lồ | lớn | nghiêm trọng | trầm trọng | đáng sợ | kinh khủng | khó khăn | gian khổ | thách thức | sự cố lớn | thảm họa","very | greatly | terribly | awfully | immense | enormous | great | serious | grave | dreadful | terrible | difficult | hard | challenging | major incident | disaster","","0","jmdict","1415000","CC BY-SA 3.0 — verify at edrdg.org before production use","JMdict/EDRDG","大変お世話になりました。","たいへんおせわになりました。","Tôi đã được giúp đỡ rất nhiều.","Thank you very much for your help.","ai_draft","jmdict_ai"
"男","おとこ","","N5","n|n-pref","đàn ông | nam giới | người đàn ông | anh chàng | gã | chàng trai | người tình nam | bạn trai | đàn ông | sự nam tính | danh dự nam giới | danh dự nam giới | danh tiếng nam giới","man | male | fellow | guy | chap | bloke | male lover | boyfriend | man | manliness | manly honor | manly honour | manly reputation","","0","jmdict","1419990","CC BY-SA 3.0 — verify at edrdg.org before production use","JMdict/EDRDG","あの男の人は誰ですか。","あのおとこのひとはだれですか。","Người đàn ông kia là ai?","Who is that man?","ai_draft","jmdict_ai"
"置く","おく","","N5","v5k|vt|aux-v","đặt | đặt chỗ | để lại (phía sau) | thành lập (tổ chức, cơ sở, vị trí, v.v.) | thiết lập | bổ nhiệm (ai đó vào vị trí nhất định) | thuê | tuyển dụng | đặt (niềm tin, đức tin, v.v.) | ghi nhớ (trong tâm) | đặt xuống dụng cụ (ví dụ bút) và ngừng làm | tiếp nhận (người thuê trọ, v.v.) | cung cấp chỗ ở trong nhà | tách biệt theo không gian hoặc thời gian | làm gì đó trước | để gì đó trong trạng thái nhất định | giữ gì đó trong trạng thái nhất định","to put | to place | to leave (behind) | to establish (an organization, a facility, a position, etc.) | to set up | to appoint (someone to a certain position) | to hire | to employ | to place (one's trust, one's faith, etc.) | to bear (in mind, etc.) | to put down a tool (e.g. a pen) hence stopping what one is doing with that tool | to take in (boarders, etc.) | to provide lodging in one's house | to separate spatially or temporally | to do something in advance | to leave something in a certain state | to keep something in a certain state","","0","jmdict","1421850","CC BY-SA 3.0 — verify at edrdg.org before production use","JMdict/EDRDG","本をここに置いてください。","ほんをここにおいてください。","Hãy đặt quyển sách ở đây.","Please put the book here.","ai_draft","jmdict_ai"
"働く","はたらく","","N5","v5k|vi","làm việc | lao động | lao động | hoạt động | vận hành | có hiệu quả | hoạt động (ví dụ ... hoạt động) | phát huy tác dụng | phạm (ví dụ tội ác) | thực hiện | làm | hành động | thực hành | luyện tập | được chia","to work | to labor | to labour | to function | to operate | to be effective | to work (i.e. ... works) | to come into play | to commit (e.g. a crime) | to perpetrate | to do | to act | to practise | to practice | to be conjugated","","0","jmdict","1451150","CC BY-SA 3.0 — verify at edrdg.org before production use","JMdict/EDRDG","毎日働きます。","まいにちはたらきます。","Tôi làm việc mỗi ngày.","I work every day.","ai_draft","jmdict_ai"
"僕","ぼく","","N5","pn|n","tôi | tôi | bạn | người hầu","I | me | you | manservant","","0","jmdict","1521400","CC BY-SA 3.0 — verify at edrdg.org before production use","JMdict/EDRDG","僕は学生です。","ぼくはがくせいです。","Tôi là học sinh.","I am a student.","ai_draft","jmdict_ai"
"有名","ゆうめい","","N5","adj-na","nổi tiếng | nổi tiếng","famous | well-known","","0","jmdict","1541620","CC BY-SA 3.0 — verify at edrdg.org before production use","JMdict/EDRDG","あの人はとても有名です。","あのひとはとてもゆうめいです。","Người đó rất nổi tiếng.","That person is very famous.","ai_draft","jmdict_ai"
"妹さん","いもうとさん","","N5","n","em gái","younger sister","","0","jmdict","1524600","CC BY-SA 3.0 — verify at edrdg.org before production use","JMdict/EDRDG","","","","","ai_draft","jmdict_ai"
"毎週","まいしゅう","","N5","n|adv","mỗi tuần","every week","","0","jmdict","1524690","CC BY-SA 3.0 — verify at edrdg.org before production use","JMdict/EDRDG","毎週日曜日に運動します。","まいしゅうにちようびにうんどうします。","Tôi tập thể dục mỗi tuần vào Chủ nhật.","I exercise every Sunday.","ai_draft","jmdict_ai"
"木","き","","N5","n","cây | cây bụi | bụi cây | gỗ | gỗ xây dựng | phách gỗ (báo hiệu bắt đầu hoặc kết thúc buổi biểu diễn)","tree | shrub | bush | wood | timber | wooden clappers (signalling the beginning or end of a performance)","","0","jmdict","1534520","CC BY-SA 3.0 — verify at edrdg.org before production use","JMdict/EDRDG","公園に大きな木があります。","こうえんにおおきなきがあります。","Có một cây lớn trong công viên.","There is a big tree in the park.","ai_draft","jmdict_ai"
"木曜日","もくようび","","N5","n|adv","thứ Năm","Thursday","","0","jmdict","1534890","CC BY-SA 3.0 — verify at edrdg.org before production use","JMdict/EDRDG","木曜日に会いましょう。","もくようびにあいましょう。","Hãy gặp nhau vào thứ Năm.","Let's meet on Thursday.","ai_draft","jmdict_ai"
"優しい","やさしい","","N5","adj-i","dịu dàng | tốt bụng | nhẹ nhàng | duyên dáng | trìu mến | hòa nhã","tender | kind | gentle | graceful | affectionate | amiable","","0","jmdict","1539040","CC BY-SA 3.0 — verify at edrdg.org before production use","JMdict/EDRDG","彼女はとても優しいです。","かのじょはとてもやさしいです。","Cô ấy rất tốt bụng.","She is very kind.","ai_draft","jmdict_ai"
